pair_id,root,commentary,label
bca_5.66,"yuktaṃ gṛdhraśṛgālāder āhārārthaṃ tu rakṣitum |
karmopakaraṇaṃ tv etan manuṣyāṇāṃ śarīrakam || 5.66 ||",nanu sannikṛṣṭārthagocaram eva sarvaṃ pramāṇam | ataḥ prasiddheḥ pramāṇāntarāgocarārthatvaṃ guṇaḥ na doṣāya ata āha na ceti | na ca pratyakṣādīni parityajya loko nāma pramāṇagaṇe pramāṇam upasaṃkhyāyate | varṇavivekasambandhāvadhāraṇayos tu pratyakṣādipramāṇatvaṃ vanasambandhaparihārayor abhidhāsyāma iti | api ca bhaved api prasiddhiḥ pramāṇaṃ yadi vyavasthitaiva prasiddhiḥ syāt | sā tv avyavasthitā | tathā hi saṃsāramocakā nāma nāstikā bāhyahiṃsām eva dharmam āhuḥ | anye tu tapaḥ prajāpatyādi pīḍātmakatvāt parapīḍāvat adharma ....... stu vidhiniṣedhapramāṇakau tadviparītau dharmādharmau saṅgirante | tad evaṃ mlecchāryāṇāṃ parasparavigānān na lokaprasiddhatvaṃ dharmādharmayor upapadyata ity āha saṃsāreti sārdhena ||,0
gg_1.14,"mlecchanivahanidhane kalayasi karavālaṃ 
dhūmaketumiva kimapi karālam |
keśava dhṛtakalkiśarīra jaya jagadīśa hare ||",yauvanayuktām mām upekṣya niṣphalaṃ śūnyatāyāṃ dṛṣṭiḥ | ayam abhiprāyaḥ | śūnyatākaruṇābhinnaṃ hi mahāsukhajñānaṃ nirmāṇasaṃbhogakāyadvayavyatirekeṇopalabhyate | nirmāṇasaṃbhogakāyau tu bhujamukhasaṃsthānamayau strīpuruṣarūpau tau ca bhāvanālabhyau | bhāvanā ca yuvativyatirekeṇa na bhavati | anyathā vikṣiptacittatvād iti yata evaṃ tasmāc chūnyasvabhāvaṃ viśeṣeṇa garhitvā nindatvā kuru tvaṃ mayā sārdhaṃ ghṛṣṭim āliṅganacumbanādikam ity arthaḥ |,0
gg_1.13,"nindasi yajñavidherahaha śrutijātaṃ 
sadayahṛdayadarśitapaśughātam |
keśava dhṛtabuddhaśarīra jaya jagadīśa hare ||",he keśava | dhṛtabuddhaśarīra | dhṛtaṃ buddhasya śarīraṃ yena tasya saṃbodhanam | he dhṛtabuddhaśarīra | tvaṃ śrutijātaṃ vedārthatattvaṃ nindasi | kasya | yajñavidheḥ yajñānāṃ vidhirvidhānaṃ tasya | kiṃbhūtam | darśitapaśughātam | darśitaḥ paśughāto māraṇaṃ yena tattathā tat | athavā kiṃbhūtaṃ śrutijātam | sadayahṛdayadarśitapaśughātam | sadayahṛdayā brāhmaṇāḥ teṣāṃ darśitaḥ paśughāto māraṇaṃ yena tattathā tat | kathaṃ nindasi | ahaheti khede | gavādipaśughātaṃ dhigiti | tasya saṃbodhane | bauddhāgamaśāstre ahiṃsā paramo dharma iti nyāyāt |,1
nasa_25,"imāṃ ṣaṇmantrarājānasaṃyuktām advayodayām |
anutpādadharmiṇīṃ gāthāṃ bhāṣate sma girāṃ pateḥ || 25 ||",imāṃ dvādaśatathāgatabhūmyupalakṣitāṃ gāthāṃ girāṃ pater bhāṣate smeti saṃbandhaḥ || kiṃbhūtāṃ ṣaṇmantrarājānasaṃyuktām iti vakṣyamāṇaṣaṇmantropetām || kimātmikām advayodayām iti | dvayaṃ grāhyaṃ grāhakaṃ ca | tan na vidyate yasya tad advayaṃ | udety asmād ity udayaḥ | advayasyodayo 'dvayodayaḥ | sa vidyate yasyā gāthāyāṃ sādvayodayā tāṃ bhāṣate sma || punar api kiṃviśiṣṭām | anutpādadharmiṇīṃ iti dharmadhātusvabhāvāṃ śūnyatāsvabhāvām ity arthaḥ ||,1
gg_4.13,"śvasitavapanamanupamapariṇāham |
madanadahanamiva vahati sadāham ||",sā rādhikā sadāhaṃ yathā bhavati tathā śvasitaṃ pavanaṃ vahati | śvasitameva pavanastam | kamiva | madanadahanamiva | kāmāgnimiva | kimbhūtam | anupamapariṇāhaṃ na vidyate upamā dṛṣṭānto yasya sa tathā anupamaḥ pariṇāho viśālatā yasya sa tathā |,1
nasa_1,"atha vajradhara śrīmān durdāntadamakaḥ paraḥ |
trilokavijayī vīro guhyarāṭ kuliśeśvaraḥ || 1 ||","prathamārambhiṇaḥ saṃtatābhyāsena kleśasya parihārārtham āha.

dṛṣṭicittaparikhedaparityāgāya kadācit karhicit diśo vyavalokayet. atha kadācit kaścit tatsamīpam āgacchet, tadā tasya praticchāyāmātraṃ viditvā svāgatavādena saṃtoṣaṇārthaṃ vilokayet. anyathā tatra tasyāvadhyānenākuśalaṃ prasavet.",0
msv_5.1.8,"tasmādabhāvavaktṛsthau dharmādharmau na śaktuyāt |
codanā cet samuddhartuṃ grastau tenaiva paśyatām || 8 ||",ataḥ sakalabhāvapramāṇanirākaraṇāt śaṅkitābhāvanirākaraṇena codanaiva dharmādharmayoḥ pramāṇamityupapannamityāha tasmāditi | paśyatāmiti | ṣaṣṭhī cānādare ityanādare ṣaṣṭhīti ||,1
seni_34,"yenājātaṃ jagad buddhaṃ buddhiḥ śuddhaiva bodhataḥ |
nijaṃ tasya jagat satyam anābhogena dhīmataḥ || SeNi 34 ||","punar api saṃvṛtisatyam āśu sambhāropacayārtham āha—jananītyādi. jananyādiśabdaiḥ prajñāmātram uktam, nāvaśyaṃ bāhyā viśeṣā iti saṃkṣepaḥ. jagajjanam ity āryalokam, anyeṣāṃ niśceṣṭatvāt. vibhāgam iti jñeyanānātvam.",0
cmt_1.5,"māṃ na jānanti yā nāryaḥ sarvastrīdehasaṃsthitām |
tāsām ahaṃ hitārthāya pañcākāreṇa saṃsthitā ||1.5||",bhaktyānandarasaḥ samāveśānandaprasarastenāplutāḥ ārdrāśayāḥ | ata eva tādṛśā iti aparimitānandarasasamudratvāt tvadrūpasarūpāḥ tava tattvaṃ jānanti | yo hi yatra vidvān sa hi tadvettyeva |,0
nasa_40,"mahābhavādrisaṃbhettā mahāvajradharo ghanaḥ |
mahākrūro mahāraudro mahābhayabhayaṃkaraḥ || 40 ||",mahābhavetyādi | tatra mahābhavādrisaṃbhetteti mahāsthāmaprāptaḥ | bhavaḥ paṇcopādānaskandhāḥ | ta evādrir ajñānaśailatvāt | tasya samyagaviparītajñānalābhād bhañjanaśīlaḥ saṃbhettā | mahāṃś cāsau bhavādrisaṃbhettā ca mahābhavādrisaṃbhettā || mahāvajradharo ghana iti sarvāpāyañjahaḥ | mahāvajraṃ samantabhadrajñānaṃ tad dhārayatīti mahāvajradharaḥ | nibiḍatvān mūrtimattvāc ca ghanaḥ || mahākrūro mahāraudra iti sarvaśokatamonirghātamatiḥ | mahāṃś cāsau krūraś ca mahākrūraḥ | durdāntānāṃ sattvānāṃ mahākrodharūpasaṃdarśanāt | mahāraudra iti | śānto 'py asau bhagavān mañjuśrīḥ sattvavinayavaśād raudratām api darśayatīti || mahābhayabhayaṃkara iti jālinīprabhaḥ | mahābhayo mahābhairavarūpadhārī śaṃkara iti | tasyāpi bhayaṃ karotīti mahābhayabhayaṃkaraḥ ||,1
gg_1.3,"vācaḥ pallavayatyumāpatidharaḥ saṃdarbhaśuddhiṃ girāṃ jānīte jayadeva eva śaraṇaḥ ślāghyo durūhadrute |
śṛṅgārottarasatprameyaracanairācāryagovardhanaspardhī ko 'pi na viśrutaḥ śrutidharo dhoyī kavikṣmāpatiḥ ||",kathaṃ punar upadeśo dharme pramāṇam ata āha autpattiketi | bādhakāraṇadoṣādhīnaṃ hy aprāmāṇyam | tatra sambandhautpattikatvapratipādanena taddvārā puruṣānupraveśābhāvāt puruṣāśrayatvāc ca śabde doṣāṇāṃ kāraṇadoṣanivāraṇaṃ tāvat kṛtam | tannirākaraṇena sahāprāmāṇyam anapoditam ity avyatirekapadaprayojanam āha abādha iti | avyatirekapadenābādhaḥ pratipādyate na hi deśakālayor ubhayor api codanājanitaṃ jñānaṃ viparyetīti | tad evaṃ bādhakāraṇadoṣanirākaraṇe kṛte 'napoditam autsargikaṃ prāmāṇyam iti tat pramāṇam ity anenoktam iti darśayati svata iti ||,0
gg_4.3,"aviralanipatitamadanaśarādiva bhavadavanāya viśālam |
svahṛdayamarmaṇi varma karoti sajalanalinīdalajālam ||",sā sajalanalinīdalajālaṃ varma kavacaṃ karoti | jalena saha vartamānāni sajalāni ca tāni nalinīdalāni ceti karmadhārayaḥ samāsaḥ | teṣāṃ jālaṃ samūhaḥ yatra tat | kasmin | svahṛdayamarmaṇi | svahṛdayameva marma jīvanasthānam | tasmin | kimbhūtam | śavilaṃ vistīrṇam | kasmai | bhavadavanāya | tādarthye caturthī | bhavato 'vanaṃ rakṣaṇaṃ tasmai | bhayahetumāha | kasmāt | aviralanipatitamadanaśarāt | aviralo nipatito madanaśarastasmāt | anena kimuktam | prayojanamāha | saṃtāpayuktāpi rādhikā svahṛdayasthaṃ kṛṣṇaṃ satataṃ paśyati jānātītyarthaḥ |,1
ht_1.5.4,"mudrā pañcakulānīti kathyate mokṣahetunā |  
vajreṇa mudryate 'neneti mudrā tenābhidhīyate || 4 ||",mudryate yeneti lakṣyate yataḥ.,1
bca_5.9,"adaridraṃ jagat kṛtvā dānapāramitā yadi |
jagaddaridram adyāpi sā kathaṃ pūrvatāyinām || 5.9 ||","syād etat—dānapāramitādiṣu katham iva cittaṃ pradhānam? sā hi sarvasattvānāṃ dāridryāpanayanalakṣaṇety āha.

dāridryaṃ hi nāma sāsravasukhabhogabubhukṣayā cittakārpaṇyam upakaraṇavaikalyaṃ vā. tad apanīya jagato yadi dānapāramitāparipūrir bhavatīty ucyate, tadā sā katham? na kathaṃcid api pūrvatāyināṃ pūrvam abhisaṃbuddhānāṃ bhagavatāṃ yujyate. kutaḥ? jagaddaridram adyāpi, nādyāpi yāvaj jagaddāridyam upaśāmyati.",1
medū_24,"pāṇḍucchāyopavanavṛtayaḥ ketakaiḥ sūcibhinnair  
nīḍārambhair gṛhabalibhujām ākulagrāmacaityāḥ |  
tvayy āsanne pariṇataphalaśyāmajambūvanāntāḥ  
sampatsyante katipayadinasthāyihaṃsā daśārṇāḥ ||","parāgamasāmyam uktvā svāgamavirodham āha—kiṃ cetyādi | iha hi madhyamakādivicārito 'rtho mantranaye phalena devatāyogena khyāpyate | tataś ca yad yena mudryate tat tatsvabhāvaṃ bhavatīti kṛtvā grāhyasya rūpādiskandhacatuṣṭayasvabhāvasya grāhyatvahānaye vairocanādayaś catvāro grāhakāḥ paratantrarūpāḥ kathyante | teṣāṃ ca mudrārthaṃ pariniṣpannarūpo grāhyagrāhakaśūnyo 'kṣobhyaś ced ucyate tad āgamoktā vajrasattvamudrā virudhyate | ratnagarbhādisthabodhicitte pariniṣpannarūpākṣobhyasadbhāvāt | vajrasattvamudrāṃ ca vinā na bauddhakṛtānto bhavatīti kathaṃ bāhyasiddhāntena na sāmyam | tathā ca kambalāmbarapādāḥ—

	sarvaḥ samānaḥ pravibhajyamānaḥ 
		sukṣmekṣikākṣāmadhiyā kṛtāntaḥ |
	bauddhasya bāhyasya vibhāgakartrī
		na syād ihaikā yadi śūnyatoktiḥ ||

	mā bhūt saṃvitpratiṣṭhānam ata eva munir bhayāt |
	bhinatti deśanādharmam uktvoktvā śūnyatātmanā ||

iti pravacanam api | 

	samastavedasiddhānāṃ kṛtānām īśvarādibhiḥ |
	bauddhānāṃ tantramantrāṇāṃ viśeṣaḥ śunyatāṃ prati ||

iti | paraparikalpitaśūnyatoktibhyas tathāgataśūnyatoktīnām abhisandhikṛto viśeṣaḥ sphuṭa iti na pratanyate ||",0
cmt_3.18,tata evaṃ vadet | adyāhaṃ te buddhajñānam utpādayāmi yenātītānāgatā pratyutpannā buddhā bhagavanto ’pratiṣṭhitanirvāṇaṃ prāptāḥ | kiṃtu na tvayedam adṛṣṭamaṇḍalapurato vaktavyaṃ ||,"catuḥkṣaṇakāraṇam iti namaskārahetur uktaḥ | tatra ke te catuḥkṣaṇāḥ | kīdṛśī ca tatparipāṭiḥ | ata āha—citram ityādi |

nanu tantroktakramam ullaṅghya kim iti tṛtīye vilakṣaṇam iṣyate | tadartham āha—haṭhayoganirākṛteḥ | tatrāyaṃ haṭhayogaḥ—vicitraṃ vividhaṃ grāhyagrāhakabhāvād āliṅganādau | vipākas tadviparīto 'vicitro grāhyābhāvāt sukho jñānabhogo ghṛṣṭau | vimardo nirvikalpaṃ darśanaṃ sukhaṃ ratnaṃ vyāpyāgraṃ yāvat | anyad vilakṣaṇaṃ rāgavarjitaṃ nirbharasukhābhāvāt | arāgavarjitaṃ sukhānubhavasmaraṇena virāgābhāvāt pāte | yad uktam—

   vicitraṃ vividhaṃ khyātam āliṅganacumbanādikam |
   vipākaṃ tadviparyāsaṃ sukhaṃ jñānasya bhuñjanam ||
   vimardam ālocanaṃ proktaṃ sukhaṃ bhuktaṃ mayeti ca |
   vilakṣaṇaṃ tribhyo 'nyad rāgārāgavivarjitam || 

iti | idaṃ nirākāravādimatena ratnānubhūtaṃ śaradamalamadhyāhnagaganāyamānaṃ samatalaṃ sātasaṃvinmātraṃ sarvanīlādyākāracakrakalaṅkāpagamād avatiṣṭhate | ākārabādhakaṃ tv ekānekaviyogādipramāṇaṃ vistarabhayān na vipañcitam | yad āhuḥ—

   tasmān nārtheṣu na jñāne sthūlābhāsas tadātmanaḥ |
   ekatra pratiṣiddhatvād bahuṣv api na sambhavaḥ ||
   paricchedo 'ntaranyo 'yaṃ bhāgo bahir iva sthitaḥ |
   jñānasyābhedino bhedapratibhāso hy upaplavaḥ || 

iti | idam eva dharmakāyaḥ | tatpṛṣṭhe maṇḍalacakrādyākāraṃ jñānaṃ sambhogaḥ | bhūtabhautikaḥ śākyamunyādyākāro nirmāṇam | eṣām ekasvabhāvatā svābhāvikaḥ kāyaḥ | evaṃ vimardo dharmaḥ | vipākaḥ sambhogaḥ | vicitraṃ nirmāṇam | vilakṣaṇaḥ svābhāvikaḥ kāyaḥ | yad uktam—""rūpakāyau tu paścimau""  iti |

""tāvad bhāvayed yāvad anupalabdhikaṃ kuryād"" ity ukte etad eva dṛṣṭāntalakṣitaṃ sādaranirantaradīrghakālābhyāsena bhāvyamāno maṇḍalacakrādyākāro niṣpādayiṣyati, pūrvapraṇidhānavaśāt sambhoganirmāṇakāyāv iti |

yadvā sātam idam anubhūtaṃ sādarādibhāvanayā sphuṭatāṃ svayam eṣyati | yad āhuḥ—

   tasmād bhūtam abhūtaṃ vā yad yad evātibhāvyate |
   bhāvanābalaniṣpattau tat sphuṭākalpadhīphalam || 

iti | atrāpi pūrvapraṇidhānāvedhavaśād rūpakāyadvayam | ayam eva ca praveśopāyaḥ | yad uktam—

   maṇḍalacakrādyupāyena svādhiṣṭhānakrameṇa ca | 

iti | madhyamārthatayā cedam evodghuṣyate |

   anucchedāt svasaṃvitter nīlādīnām abhāsanāt |
   nimittānām anutpādān madhyamā pratipan matā || 

iti | atra nimittānutpādo 'bhiniveśābhāvo vivakṣitaḥ | tena sadasadādyabhiniveśābhāvāc catuḥkoṭirahitatvam | caturthatāpy atra ""caturthaṃ tatpunas tathā"" iti vacanāt | tat prajñājñāne 'nubhūtaṃ nirākāravedanaṃ punar iti nīlādyākāracakramalāpagame tatheti prajñājñānam iva boddhavyam ||

sākāravādinas tu nirākāraṃ jñānaṃ svapne 'pi nānubhūyata iti vadanti | tad āhuḥ—

   nākāracakram avadhūya dhiyo 'sti vṛttis
   tadbādhane balini madhyanaye jayaśrīḥ |
   no ced anindyam idam advayam eva citraṃ
   ceto nirākṛtimatasya tu ko 'vakāśaḥ || 

iti | na caivaṃ mantavyam—ākāraprakāśābhāvād ākāraḥ prāṅ nāstīti | tanniścayābhāve 'py aśakyāpahnavasyānubhūyamānasya pṛṣṭollekhaniścīyamānasya ca nīlādivedanasya bhāvāt | yad āhuḥ—
 
	yad yathā bhāsate jñānaṃ tat tathaivānubhūyate |
	iti nāmaikabhāvaḥ syāc citrākārasya cetasi || 

iti | tataś citrādvaitavedanam eva param asti | atrāpi ca granthavistarabhayāt sādhakabādhakapramāṇacintā na kṛtā | etad eva catuḥkoṭirahitatayā madhyamārthenāpi ghaṭayanti | tathā coktam—

	nāsat prakāśavapuṣā na ca sat tadanyair
		ekena na dvitayam advitayaṃ na tābhyām |
	ittathaṃ jagad yadi catuḥśikharīvimuktaṃ 
		ko bhāṣyakāramatamadhyamayor viśeṣaḥ || 

iti | vyāvṛttikṛtabhedena sambhogābhinno 'pi vimardo dharmaḥ | vipākaḥ sambhogaḥ | vicitraṃ nirmāṇam | vilakṣaṇaḥ svābhāvikaḥ kāyaḥ | lakṣaṇabhūtaṃ prajñājñānaṃ tathaivābhyasyamānaṃ punaḥśabdavācyaṃ sac caturthaṃ saptāṅgayuktaṃ sādhyaṃ syāt | tatra saptāṅgāni—sambhogaṃ vitteḥ | sampuṭaṃ samāpatteḥ | mahāsukhaṃ sātarūpatayā | niḥsvabhāvaṃ kalpitavirahāt | kāruṇyanirbharaṃ pūrvapraṇidhānāvedhavaśena sambhogādinā sattvārthakaraṇāt | nirantaraṃ madhye 'ntarābhāvāt | nirnirodhaṃ pravāhānucchedāt | tad uktam | 

	sambhogasampuṭamahāsukhaniḥsvabhāva-
		kāruṇyanirbharanirantaranirnirodhaiḥ | 
	aṅgair mameṣṭam iha saptabhir eva yuktaṃ
		sādhyaṃ pramāṇaparibhāvitabuddhiśastam || 

iti | yad vālam anena saptāṅgayoginā sādhanena | aniyama evātra | yato nairātmyāyoginīcakraṃ bhāvyamānaṃ buddhatvahetuḥ | atha cātra saptāṅgayogi sādhanaṃ na bhavati | sampuṭābhāvāt | tad uktam—

	sādhyaṃ saptāṅgasaṃyuktaṃ tad eva yadi sādhanam | 
	nairātmyāyoginīcakraṃ bodhaye kiṃ na sammatam || 

iti | athaivaṃ matir yat tatrāpi khaṭvāṅgopāyasampuṭatvam asti | yad uktam—

	khaṭvāṅgasampuṭā devī sambhogādisamānvitā |
	nairātmyāyoginī hanta bodhaye kiṃ na sādhanam || 

iti | tad apy asundaram | pāramitānaye 'pi vivakṣitasākṣāt sampuṭābhāve 'pi prajñopāyātmakabodhicittasampuṭasambhavena mantranayasyeva saptāṅgayuktasādhyasiddhiprasaṅgāt |

	viśiṣṭaṃ sampuṭaṃ hitvā anyathā yadi kalpyate |
	śūnyatetarasāmpuṭyāt prasaṅgaḥ syān nayāntare || 

athātra sādhane saptāṅgayuktāsty eva | yataḥ—

	stanau hṛtvā bhaved bolaṃ kakkolamadhyasaṃsthitam ||
	tīradvayaṃ bhaved ghaṇṭā kiñjalkaṃ bolakaṃ bhavet | 

iti | tad apy apeśalam | yataḥ siddhyavasthāyām idaṃ sarvaṃ na sādhanāvasthāyām | atas tathāvidhasādhanābhāve 'pi saptāṅgayuktasādhyasiddhiprasaṅgaḥ pāramitānaye 'pi durnivāraḥ |

	prāg asampuṭatā bhāvyā niṣpattau sā bhaviṣyati |
	etat sammatam asmākaṃ sādhanaṃ punar anyathā ||

iti | etad eva cānye māyopamādvaitam iti varṇayanti | yathā svapnānubhūtakāminīratisaṃvedanaṃ tatpṛṣṭhabhāvyaparasvapnasaṃvedanenānubhūyamānaṃ nātyantocchedena mṛṣānubhūteḥ | nāpi saj jāgraddaśopalabdhārthakriyākārisvaparavedyavastuvad avisaṃvādābhāvāt | tadāhuḥ—

	svapnāt svapnaṃ yadaiva syāc ciccitrālīkatā tadā |
	naiva satyam asadvitter na cocchedaḥ prakāśataḥ || 

iti | tathaitad api viśvaṃ nātyantocchedenālīkaṃ vitteḥ | nāpi paramārthasat ""sadasator utpādāyogād"" ityādinā pratītyasamutpannatvenādhyavasitasya paramārthato 'tyantājātatvenānutpannasya sattvāyogāt | yathoktam—

	yat pratītyasamutpannaṃ notpannaṃ tat svabhāvataḥ | 
	yat svabhāvena notpannam utpannaṃ nāma tat katham || 

atrāpi ca caturthatvadharmakāyādiyuktatvavyavasthā pūrvavad eva boddhavyā ||",0
bca_5.42,"bhayotsavādisaṃbandhe yady aśakto yathāsukham |
dānakāle tu śīlasya yasmād uktam upekṣaṇam || 5.42 ||","samādhānaparityāgāvakāśam āha.

agnidāhādi bhayam. tathā ratnatrayapūjādikṛta utsavaḥ. samadhikataraḥ sattvārthādir vā. tatsaṃbhave yadi sthātum aśaktaḥ, tadā kāmacāra ity anujñātam, sāpattiko na bhavatīty arthaḥ. kutaḥ punar ayam aniyamo labhyata ity āha—dānetyādi | śīlaṃ yady api dānāt prakṛṣṭam, tathāpy avaraśikṣāyāṃ śikṣamāṇasya tadanantaram eva uttaraśikṣāvasthitasyābhyāsapāṭavābhāvāt kathaṃcit tāvatkālaṃ tato nivartamānasyāpi nāpattiḥ. dānasyāsau kālo na śīlasya. ata evoktam—yady aśakta iti. etāvanmātreṇedam udāharaṇam. yathoktam—tatraikasyāṃ śikṣāyāṃ niṣpādyamānāyām aśaktasya, itaraśikṣānabhyāsādanāpattiḥ. āryākṣayamatisūtre 'py evam avocat—

	dānakāle śīlopasaṃhārasyopekṣā.

iti. na cātaḥ śithilena bhavitavyam.",1
ssa_1.14,"śivo bhūtvā yajeteti bhakto bhūtveti kathyate |
tvameva hi vapuḥ sāraṃ bhaktairadvayaśodhitam || 1.14 ||","śivotbhūtvā iti | ""śivo bhūtvā śivaṃ yaje"" iti yadāmnāyeṣūcyate tatra dehapāta eva śivateti ye manyante teṣāṃ sati dehe śivībhāvābhāvādyajamānatānupapatteḥ svasvarūpaśivasamāveśabhaktiśāly eva yajanaṃ jānātīti tātparyam | anenaivāśayenāha tvameva yataḥ sāram utkṛṣṭaṃ vapuḥ svarūpaṃ advayena bhedaśaṅkāśaṅkuśataśātinā śodhitaṃ nirmalīkṛtaṃ bhaktairiti |",1
bca_5.57,"ātmasattvavaśaṃ nityam anavadyeṣu vastuṣu |
nirmāṇam iva nirmānaṃ dhārayāmy eṣa mānasam || 5.57 ||",tāṃ rādhāṃ bhṛśamatyarthaṃ ramayāmi krīḍayāmi | kimbhūtām | hṛdi saṃgatām | hṛdaye saṃgatāṃ saṃlagnām | katham | aniśaṃ vāraṃvāram | kimiti vitarke | vane vanamadhye | anusarāmi | anugacchāmi | kimiha nikuñje vṛthā vilapāmi | mithyā paridevanaṃ karomi | kiṃ vitarke paripraśne kṣepe nindāprakāśayoriti vistaraḥ |,0
nasa_12,"yātītair bhāṣitā buddhair bhāṣiṣyante hy anāgatāḥ |
pratyutpannāś ca saṃbuddhā yāṃ bhāṣante punaḥ punaḥ || 12 ||",punar api kiṃviśiṣṭam ity āha | yātītair ityādi | atītair buddhair yā bhāṣitā anāgatāś ca ye samyaksaṃbuddhā hi yasmād yāṃ bhāṣiṣyante punaḥ | pratyutpannāś ca buddhā bhagavanto bhāṣante yāṃ nāmasaṃgītiṃ punar apīti || pratyutpannāś ca saṃbuddhā yāṃ bhāṣante punaḥ punaḥ ||,1
taraa_15,"prajñājñānād uttaraṃ bodhicittā-
svādaṃ turyaṃ sekam āhāvaraṃ tat |
yasmāt sarvo bhāvanāsu prayāso
vyarthaḥ prāptas tatphalasya prasiddheḥ || 15 ||","prajñājñānetyādi. prajñājñānopadeśād uttarakālaṃ yat bodhicittasyāmṛtarūpasya rasanayā grahaṇam, tat turyaṃ caturthaṃ sekam āha kaścit. tac cāvaraṃ hīnam, vinikṛṣṭam iti yāvat. kasmād avaram? yasmāt sarvaprayāso mantramudrādevatādyākārabhāvanāsu punaḥpunaranuṣṭhānalakṣaṇas tathāgatokto vyarthaḥ prāptaḥ. kutaḥ? tatphalasya bhāvanāsādhyasya phalasya bodhicittāsvādakāla eva prasiddhatvāt prāptatvāt, anyasya viśiṣṭasya phalasyābhāvād iti yāvat.",1
bca_5.51,"lābhasatkārakīrtyarthi parivārārthi vā punaḥ |
upasthānārthi me cittaṃ tasmāt tiṣṭhāmi kāṣṭhavat || 5.51 ||",kīrtir yaśaḥ. parivāraḥ dāsīdāsakarmakarādiḥ. upasthānaṃ pādadhāvanamardanādi. ebhir arthi tadabhilāṣaṃ mama cittam. tasmāt tiṣṭhāmi kāṣṭhavat.,1
cmt_1.12,"sa mahāvyādhibhir grasto viṣṭhāmūtramalīkṛtaḥ |
ṣaṇmāsābhyantare tasya mṛtyuduḥkhaṃ bhaviṣyati || 1.12 ||",mahāvyādhiratisārapramehādiḥ | mṛtyuduḥkhaṃ maraṇameva ||,1
cmt_1.2,"atha bhagavān vajrasattvaḥ kṛṣṇācalasamādhiṃ samāpadyedam udājahāra |
bhāvābhāvavinirmuktaś caturānandaikatatparaḥ |
niṣprapañcasvarūpo ‘haṃ sarvasaṃkalpavarjitaḥ ||1.2||","atiguptatvāt | nanu tadā tvayā katham śrutam iti ced āha || 
athetyādi | ayam arthaḥ | tena vihāreṇa yadā caturānandasukham anubhūya tadanantaraṃ sarvapuruṣeṣu mahākaruṇām āmukhīkṛtyāt | evaṃ kṛṣṇācalasamādhiṃ samāpadyedaṃ vakṣyamāṇam udājahāra udāhṛtavān | tadā śrutam ity arthaḥ | saṅgītikārasya mama vajrapāṇeḥ śrotrendriyarūpatvād bhagavadbhagavatīdeha eva sthitvā mayā śrutam iti bhāvaḥ ||
kim udāhṛtavān | bhāvābhāvetyādi | bhāva ānandaparamānandavikalpaḥ | abhāvo viramānandavikalpaḥ | tābhyāṃ vinirmuktas tyaktaḥ | catvāra ānandās tatra prajñopāyābhyām anyonyānurāgalakṣaṇam āliṅganacumbanastanamardananakhadānādinā yantrārūḍhabandhena vajrapadmasaṃyogaṃ yāvad ānandaḥ | etena kiṃcit sukham utpadyate | tataḥ padmāntargatavajracālanena yāvan maṇimūlaṃ bodhicittam āyāti tāvat paramānandaḥ | etena tadadhikaṃ sukham utpadyate | maṇimūlād yāvat padmodarāntargatam aśeṣaṃ na bhavati tāvat sahajānandaḥ | etena grāhyagrāhakagrahaṇābhimānarahitaṃ paramaṃ sukham utpadyate | ataḥ paraṃ yāvan niśceṣṭībhūya sukhaṃ bhuktaṃ mayeti vikalpayati tāvad viramānandaḥ | virameṇa trividhasukhavisargeṇa ānando harṣo yatra sa tathā | etena sukhānubhavasmaraṇarūpaṃ sukham utpadyate | tair ekam ānandādivikalparahitaṃ sukhajñānamātraṃ tena tatpara āsakta ity arthaḥ || 
niḥśabdo niṣedhe prapañca ādhārādheyacakrabhāvanārūpaḥ tena svasya rūpaṃ yasya sa tathā | saṃkalpaḥ svarganarakādihetukarmasukhaduḥkhādiphalavikalpaḥ ||",1
bca_5.46,"mṛnmardanatṛṇacchedarekhādyaphalam āgatam |
smṛtvā tāthāgatīṃ śikṣāṃ bhītas tatkṣaṇam utsṛjet || 5.46 ||","aparam api niṣphalavarjanāya prātimokṣoddiṣṭam ācaret ity āha.

bhūmiphalakādiṣu nakhadaṇḍādinā rekhākarṣaṇalekhanādi niṣprayojanam āgatam āpatitaṃ vivarjayed bhagavatātra nivṛttir ājñapteti saṃsmṛtya, tadatikramavipākaphalabhayāt. tatkṣaṇam iti na tatra kālaparilambhaṃ kuryāt.",1
gg_1.44,"karatalatālataralavalayāvalikalitakalasvanavaṃśe |
rāsarase saha nṛtyaparā hariṇā yuvatī praśaśaṃse ||","atraivopacayam āha.

naiva asminn arthe pravṛttimato mama ihaloke vā upakṣayaleśo 'pi saṃbhavati. upacayaḥ punarvidyata eveti darśayati—paratra mahatsukhaṃ paraguṇābhinandanāt. evamakriyamāṇe punarapacayo dṛśyate, ubhayaloke 'pi duḥkhaṃ paraguṇāsahanāt.",0
gg_1.31,"madanamahīpatikanakadaṇḍarucikesarakusumavikāśe |
militaśilīmukhapāṭalipaṭalakṛtasmaratūṇavilāse ||",punaḥ kiṃbhūte | madanamahīpatikanakadaṇḍarucikesarakusumavikāśe | madanaścāsau mahīpatī rājā ca | tasya kanakadaṇḍaśchatraṃ tasya ruciriva ruciḥ yeṣāṃ tāni tathā | tāni ca kesarakusumāni nāgakesarakusumāni teṣāṃ vikāśo vikasanaṃ yasmin sa tathā tasmin | punaḥ kiṃbhūte | militaśilīmukhapāṭalipaṭalakṛtasmaratūṇavilāse | militāḥ śilīmukhāḥ ṣaṭpadāḥ yasmin tattathā | tadyatpāṭalipaṭalaṃ pāṭalikusumanivahaṃ ca tena kṛtvā kṛtaḥ smaratūṇavilāsaḥ smarasya madanasya tūṇīrasya śobhākāro yasmin sa tathā |,1
