pair_id,root,commentary,label
bca_5.102,"sadā kalyāṇamitraṃ ca jīvitārthe 'pi na tyajet |
bodhisattvavratadharaṃ mahāyānārthakovidam || 5.102 ||","yad uktaṃ kalyāṇamitrān utsargād iti tadāha.

kalyāṇakarmaṇy abhyudayaniḥśreyasaprāptilakṣaṇe mitram asādhāraṇo bandhuḥ, tat kāyajīvitavipraṇāśabhayabhīto 'pi na tyajet. kalyāṇamitrānuśaṃsāś ca prajñāpāramitāyām āryāṣṭasāhasrikāyāṃ sadāpraruditaparivartād veditavyāḥ. caturdharmakasūtre 'py uktam—

	kalyāṇamitraṃ bhikṣavo bodhisattvena mahāsattvena yāvajjīvaṃ na tyaktavyam api jīvitahetoḥ.

iti. aparityājyasya kalyāṇamitrasya lakṣaṇam āha bodhisattvaśikṣāsaṃvare vyavasthitam. mahāyānārthapaṇḍitam. etādṛśaṃ sudurlabham.",1
medū_5,"dhūmajyotiḥsalilamarutāṃ saṃnipātaḥ kva meghaḥ  
sandeśārthāḥ kva paṭukaraṇaiḥ prāṇibhiḥ prāpaṇīyāḥ |  
ity autsukyād aparigaṇayan guhyakas taṃ yayāce  
kāmārtā hi prakṛtikṛpaṇāś cetanācetaneṣu ||","nanu cetana sādhyam arthaṃ katham acetanena kārayituṃ pravṛtta ity apekṣāyāṃ kaviḥ samādhatte—dhūmeti || dhūmaś ca jyotiś ca salilaṃ ca marudvāyuś ca teṣāṃ sannipātaḥ saṅghāto meghaḥ kva | acetanatvāt sandeśānarha ity arthaḥ | paṭukaraṇaiḥ samarthendriyaiḥ || ""karaṇaṃ sādhakatamaṃ kṣetragātrendriyeṣv api"" ity amaraḥ || prāṇibhiś cetanaiḥ || ""prāṇī tu cetano janmī"" ity amaraḥ || prāpaṇīyāḥ prāpayitavyāḥ | sandiśyanta iti sandeśāsta evārthāḥ kva | ity evam autsukyād iṣṭārthodyuktatvāt || ""iṣṭārthodyukta utsukaḥ"" ity amaraḥ || sampradānatvāt kuśalapraśnenābhimukhīcakārety arthaḥ | aparigaṇayann avicārayan guhyako yakṣas taṃ meghaṃ yayāce yācitavān || ""yācṛ yācñāyām"" || tathā hi | kāmārtā madanāturāś cetanāścācetanāś ca teṣu viṣaye prakṛtikṛpaṇāḥ svabhāvadīnāḥ | kāmāndhānāṃ yuktāyuktavivekaśūnyatvād acetanayācñā na virudhyata ity arthaḥ || atra meghasandeśayor virūpayor ghaṭanād viṣamālaṅkāraḥ | tad uktaṃ—""viruddhakāryasyotpattir yatrānarthasya vā bhavet | virūpaghaṭanā cāsau viṣamālaṅkṛtis tridhā"" || iti | sā cārthāntaranyāsānuprāṇitā tatsamarthakatvenaiva caturthapāde tasyopanyāsāt ||",1
gg_3.3,"māmiyaṃ calitā vilokya vṛtaṃ vadhūnicayena |
sāparādhatayā mayāpi na vāritātibhayena |
hari hari hatādaratayā gatā sā kupiteva ||",iyaṃ rādhā māṃ śrīkṛṣṇaṃ vilokya dṛṣṭvā calitā nirgatā | kimbhūtam | vṛtaṃ parivṛtam | kena | vadhūnicayena | gopavadhūnāṃ nicayaḥ samūhastena | mayā na nivāritā atibhayena | kayā | sāparādhatayā | saha aparādhena vartata iti sāparādhastasya bhāvaḥ sāparādhatā tayā | sā rādhikā kupiteva kruddheva gatā yātā | kayā | hatādaratayā | hato vinaṣṭo ādaraḥ satkārastasya bhāvastayā | hari hari śiva śiva khede 'rthe dvau śabdau bhavataḥ |,1
cmt_3.27,"sā cāha |
aho madīyaṃ yat padmaṃ sarvasukhasamanvitam |
sevayed yo vidhānena tasyāhaṃ siddhidāyinī || 3.27 ||","tathāpi nātrābhiniveśaḥ kārya ity āha.

ācchidyeti balāt. bhavato gṛhītvā niṣkṛpo mṛtyus tava kāyaṃ gṛdhrebhyo dāsyati. tadāpi na kaścit pratikāro bhaviṣyati ity abhiprāyaḥ.",0
seni_28,"vicitraṃ karmamudrāto vipāko jagadātmatā |
sthairyaṃ vilakṣaṇaṃ tatra vimardo jagadīkṣaṇam || SeNi 28 ||","caturānandasvabhāvā kāyikī karmamudroktaiva | vācasīṃ dharmamudrāṃ caturānandasvabhāvām āha—vicitram ityādi | karmamudrāto nimittāt sadgurūpadeśena vacasā pratīyamānā jagadātmatā citrollekhatvād vicitram | saiva ca bhāvanayā nirvedhābhimukhyā citrollekhāpagamād vipākaḥ | tatra jagadātmatāyāṃ bhāvanāprakarṣād yad anullekhasya sthairyaṃ tad vilakṣaṇam | itthaṃ sarvākāravaropetaśūnyatākhyajagadātmatāyāṃ sthairye 'pi bhāvakasya yogino 'pratiṣṭhānādhimokṣeṇa tathaiva vyavaharamāṇasya yaj jagadīkṣaṇam ālocanaṃ sa vimardaḥ | eṣu vicitrādiṣv ānandacatuṣṭayaṃ kramato yojyam | atrāpi ""caturthaṃ tat punas tatheti"" caturthaṃ pūrvavat | yadā ""eka eva suratānandaś catuḥsaṅkhyāvicchinnaḥ"" iti vacanāt sarvaṃ sahajarūpaṃ tadā dharmamudrā caturānandarūpaika eva paramānandaḥ ||",1
ht_1.5.9,"kulāni ṣaḍvidhāny āhuḥ saṃkṣepeṇa tu pañcadhā |  
paścāt trividhaṃ yānti kāyavākcittabhedanaiḥ || 9 ||",viditaitajjñānasya yogino niṣṭhām āha—jñānāmṛtetyādi | subodham ||,0
cmt_4.17,"hanyāt khaḍgena cākṣobhyaṃ pitaraṃ paścāt prabhakṣayet |
māmakyāpi tatas taṃ ca bhakṣitaṃ vai prakalpayet || 4.17 ||",punaḥ kiṃbhūte | mādhavikāparimalalalite | mādhavikāyāḥ kusumitavāsantyāḥ parimalo gandhaḥ tena lalitaḥ ramaṇīyaḥ tasmin | punaḥ kiṃbhūte | navamālatijātisugandhau | navā nūtanāśca tā mālatyaśca tāsāṃ jātiḥ prādurbhāvaḥ | janī prādurbhave ityasya jādeśe atipratyayaḥ | tathā śobhano gandho yasmin sa tathā athavā navamālikayā kāraṇabhūtayā puṣpaviśeṣeṇa atisugandhau | navā ca mālikā ceti tayā | punaḥ kiṃbhūte | mohanakāriṇi | mohanaṃ vaicityaṃ kartuṃ śīlamasyeti sa tathā tasmin | keṣāṃ | munimanasāmapi | munayo jitendriyāḥ vanavāsino vikārahīnāḥ nityanaimittikādivratācāravantasteṣāmapi | punaḥ kiṃbhūte | taruṇākāraṇabandhau | taruṇānāṃ yuvajanānāṃ akāraṇena upakāraṃ vinaiva bandhuḥ hitakārī kuṭumbasahāyaḥ kāmoddīpanatvāt |,0
medū_13,"mārgaṃ tāvac chṛṇu kathayatas tvatprayāṇānurūpam  
sandeśaṃ me tad anu jalada śroṣyasi śrotrapeyam |  
khinnaḥ khinnaḥ śikhariṣu padaṃ nyasya gantāsi yatra  
kṣīṇaḥ kṣīṇaḥ parilaghu payaḥ srotasāṃ copabhujya ||","iti manasi nidhāya tathaiva saṃyatātmā tiṣṭhet. trapādarabhayānvitaḥ—apratirūpe karmaṇi trapā lajjā, śikṣāyām ādaraḥ, tadatikrame bhayam. buddhabodhisattveṣv eva vā trapādayaḥ. evaṃ sati aparo 'pi viśeṣaḥ syād ity āha—buddhetyādi. tad evaṃ viharatas tasya pratikṣaṇam akāmata eva buddhānusmṛtiḥ syāt.",0
nasa_11,"gambhīrārthām udārārthāṃ mahārthām asamāṃ śivāṃ |
ādimadhyāntakalyāṇīṃ nāmasaṃgītim uttamāṃ || 11 ||","ataḥ idam api prātimokṣaniṣiddhaṃ nācaraṇīyam ity āha.

kheṭasya śleṣmaṇo visarjanam apāvṛtaṃ na kuryāt. jale sthale bhogya upabhogye mūtrapurīṣāder api kutsitam. atrāpi devatādyavadhyānād apuṇyaṃ prasavet.",0
bca_5.60,"rakṣasīmaṃ manaḥ kasmād ātmīkṛtya samucchrayam |
tvattaś cet pṛthag evāyaṃ tenātra tava ko vyayaḥ || 5.60 ||","evaṃ sarvathānupayogini kāye sāpekṣatāṃ nirasyann āha.

he manaḥ, anātmakam eva ātmatvena svīkṛtya māṃsāsthipuñjaṃ kāyasaṃjñakaṃ kasmāt kāraṇāt tvaṃ rakṣasi? kim evam iti cet, bhavato yadi bhinna evāyaṃ kāyaḥ. tena asyāpacaye tava kim apacīyate?",1
nasa_20,"sādhu vajradhara śrīmān sādhu te vajrapāṇaye |
yat tvaṃ jagaddhitārthāya mahākaruṇayānvitaḥ || 20 ||",sādhu vajradharetyādi | te tava vajrapāṇeḥ sādhu | śrīmān he vajradhara yat yasmāt tvaṃ mañjuśrījñānakāyasya saṃbandhinī yā nāmasaṃgītis tāṃ mattaḥ śrotuṃ samudyatas tat tasmāt he guhyakādhipa te tava sādhu deśayāmīti saṃbandhaḥ || kimarthaṃ tvayāhaṃ pṛṣṭaḥ | jagaddhitārthāyeti | jagadanugrahāya mahākaruṇayānvitaḥ san ||,1
seni_11,"yogādhyāye 'pi—
jñānāmṛtena tṛptasya kṛtakṛtyasya yoginaḥ |
naivāsti kiñcit kartavyam asti cen na sa tattvavit || SiNe 11 ||",viditaitajjñānasya yogino niṣṭhām āha—jñānāmṛtetyādi | subodham ||,1
nasa_22,"tat sādhu deśayāmy eṣa ahaṃ te guhyakādhipa | 
śṛṇu tvam ekāgramanās tat sādhu bhagavann iti || 22 ||","tvayīti || kṛṣer halakarmaṇaḥ phalaṃ sasyaṃ tvayi || adhikaraṇavivakṣāyāṃ saptamī || āyattam adhīnam || ""adhīno vighna āyattaḥ"" ity amaraḥ || iti hetoḥ prītyā snigdhaiḥ | akṛtrimapremārdrair ity arthaḥ | bhrūvikārāṇāṃ bhrūvilāsānām anabhijñaiḥ | pāmaratvād iti śeṣaḥ | janapadavadhūnāṃ pallīyoṣitāṃ locanaiḥ pīyamānaḥ sādaraṃ vīkṣyamāṇaḥ san | mālaṃ mālākhyaṃ kṣetraṃ śailaprāyam unnatasthalam || ""mālam unnatabhūtalam"" ity utpalamālāyām || sadyas tatkālam eva sīrair halair utkaṣaṇena karṣaṇena surabhi ghrāṇatarpaṇaṃ yathā tathā āruhya || tatrābhivruṣyety arthaḥ || ""surabhir ghāṇatarpaṇaḥ"" ity amaraḥ || kiñcit paścāl laghugatis tatra nivṛṣṭatvāt kṣipragamanaḥ san ""laghu kṣiprataraṃ drutam"" ity amaraḥ || bhūyaḥ punar apy uttareṇaivottaramārgeṇaiva vraja gaccha || tṛtīyāvidhāne ""prakṛtyādibhya upasaṃkhyānam"" iti tṛtīyā || yathā kaścid bahuvallabhaḥ patiḥ kutracit kṣetre kalatre gūḍhaṃ vihṛtya || ""kṣetraṃ śarīre kedāre siddhasthānakalatrayoḥ"" iti viśvaḥ || dākṣiṇyabhaṅgabhayān nīcamārgeṇa nirgatya punaḥ sarvādhyakṣa iva sañcarati tad vaditi dhvaniḥ ||",0
seni_30,"anābhogaṃ hi yaj jñānaṃ tac cācintyaṃ pracakṣate |
sañcintya yad acintyaṃ vai tad acintyaṃ bhaven na hi || SeNi 30 ||","katham ity āha—brahmetyādi. yata eva suviśuddhabodharūpatvād asau buddhas tad eva paraṃ brahma. tasmāt sa eva brahmā. nirvṛttita iti mokṣarūpatvād ity arthaḥ. nirvṛtir nirvāṇaṃ mokṣo niḥśreyasaṃ buddha iti paryāyāḥ. viṣaṇād iti tādātmyena praveśāt. kva? paramagambhīre dharmakāye. viśateḥ ktapratyayaḥ ṣatvaṇatve ca. sadā sukalyāṇād iti dhruvakalyāṇatvāt paramakalyāṇatvāc ca. sarvar ityādi. yasmād asau sarveṣām ātmani dharmadhātau vedakatvena sthitaḥ, tasmāt sarvaḥ.",0
nasa_10,"bhagavan jñānakāyasya mahoṣṇīṣasya gīṣpateḥ |
mañjuśrījñānasattvasya jñānamūrteḥ svayaṃbhuvaḥ || 10 ||",mukhaṃ pūritaṃ kṛtvā mahatkavalagrahaṇāt. saśabdaṃ sukasunikādiśabdena. prasṛtānanaṃ dūraṃ vidāritamukham. pralambapādaṃ bhūmyādyalagnapādaṃ khaṭvādyārohaṇe sati nāsīta. dvāv api bāhū samamekasmin kāle na mardayet. kramamardane na doṣaḥ. sati pratyaye.,0
seni_38,"vicitraṃ karmamudraiva dharmamudrā vipākajā |
vilakṣaṇaṃ mahāmudrā vimardaḥ samayo bhavet || SeNi 38 ||",vidyāgurūṇām idānīṃ stutinamaskārau karoti abhivandyeti | śiṣyadhīpadminīnāṃ ravīn iva vikāsakān gurūnādau vande | tato vārttikaṃ kariṣye | teṣām eva prasādena dṛṣṭenārthatattvopadeśenādṛṣṭena ca stutinamaskārabhuvā | gurvanugamanādayo 'pi hy ācārapramāṇakā eva | vārttikagrahaṇena ca duruktabhaṅgam anuktavacanaṃ ca samādhatte | mīmāṃsāśabdena nyāyaśāstram idam ato nyāyānusāreṇādhikaraṇabhaṅgādyadūṣaṇam iti darśayati | ślokapadena ca lāghavavikāsaṃ kṣipāma iti darśayati | tataś ca sūtritaprāyam imam artham avahitā jijñāsavo bhāvayiṣyantīti tātparyārtha iti ||,0
ssa_1.3,"labdhatvatsaṃpadāṃ bhaktimatāṃ tvatpuravāsinām  |
sañcāro lokamārge 'pi syāttayaiva vijṛmbhayā || 1.3 ||","labdhatvaditi | ye samāveśamayapraśastabhaktiyuktāḥ ata eva labdhatvatsaṃpadaḥ tvatpureviśvapūrake tvatsvarūpe vasanti tacchīlāḥ teṣāṃ lokamārge api yaḥ sañcāraḥ vyavahāraḥ, sa tayaiva samāveśarasānandamayyā, vijṛmbhayā vikasvaratayā syāt bhavatyeva | atha ca ye labdhalaukikaśriyaḥ tvadbhaktāḥ tvanmaṇḍalavāsinaḥ te sarve spṛhaṇīyatvāt sadā vibhūtimuditā iti samāsoktyā gamayati |",1
bca_5.67,"evaṃ te rakṣataś cāpi mṛtyur ācchidya nirdayaḥ |
kāyaṃ dāsyati gṛdhrebhyas tadā tvaṃ kiṃ kariṣyasi || 5.67 ||",he deva he hare tvaṃ jaya jaya | svaśaraṇāgatasakalajanaramaṇa tvaṃ sarvotkṛṣṭatayā vartasva | he śritakamalākucamaṇḍala | śritamāśritaṃ kamalāyāḥ lakṣmyāḥ kucamaṇḍalaṃ kucābhogaḥ yena sa tathā tasya saṃbodhane | he śritakamalākucamaṇḍala | punaḥ kiṃbhūta | he dhṛtakuṇḍala | dhṛtaṃ kuṇḍalaṃ yena sa tathā tasya saṃbodhane | punaḥ kiṃbhūta | he kalitalalitavanamāla | kalitā svīkṛtā lalitā manoharā vanamālā yena sa tathā tasya saṃbodhane | he kalitalalitavanamāla | he hare he deva jaya jaya jayayukto bhava | sarvotkarṣeṇa vartasva |,0
gg_1.44,"karatalatālataralavalayāvalikalitakalasvanavaṃśe |
rāsarase saha nṛtyaparā hariṇā yuvatī praśaśaṃse ||",rāsarase gopī krīḍāyāṃ kāpi yuvatiḥ hariṇā śrīkṛṣṇena praśaśaṃse tuṣṭuve | kimbhūtā | tena saha nṛtyaparā | kimbhūte | karatalatālataralavalayāvalikalitakalasvanavaṃśe | karāṇāṃ talāni teṣāṃ tālāḥ vādyaprakārāḥ taistaralāścañcalāśca valayāvalayo bhūṣaṇaviśeṣarājayaśca | tābhiḥ kalito viśeṣitaḥ kalasvano madhuradhvanirvaśo yatra tathā tasmin |,1
cmt_1.10,"gurau bhaktaḥ kṛpāluś ca mantrayānaparāyanaḥ |
bhaktaś caṇḍeśvare nityaṃ tasya tantraṃ pradarśayet || 1.10 ||",gurau upadeśadātari | bhaktaḥ | gurvārādhanakrameṇa kāyavākcittoḥ sevanāt | kṛpāluḥ sarvasattvaduḥkhoddharaṇamānasaḥ | mantrayānaṃ mantranayaḥ | tantraparāyaṇas tadekāśaktaḥ | caṇḍeśvare caṇḍamahāroṣaṇe ||,1
seni_18,"bhagavadgītāyām api—
nāsato vidyate bhāvo nābhāvo vidyate sataḥ |
ubhayor api dṛṣṭo 'nto hy anayos tattvadarśibhiḥ || SeNi 18 ||","ataḥ idam api prātimokṣaniṣiddhaṃ nācaraṇīyam ity āha.

kheṭasya śleṣmaṇo visarjanam apāvṛtaṃ na kuryāt. jale sthale bhogya upabhogye mūtrapurīṣāder api kutsitam. atrāpi devatādyavadhyānād apuṇyaṃ prasavet.",0
bca_5.105,"śikṣāsamuccayo 'vaśyaṃ draṣṭavyaś ca punaḥ punaḥ |
vistareṇa sadācāro yasmāt tatra pradarśitaḥ || 5.105 ||",maṇḍala ityādi | etat tantroktamaṇḍala iti bhāvaḥ | samāhito ’nuddhatakāyavāṅmanovyāpārāt | śraddhā abhisampratyayaḥ | yatna udyogaḥ ||,0
taraa_4,"ānandarūpaṃ svavid aprakampyaṃ
vedāntinaḥ sādhyam uṣanti śāntam |
saśrāvakāḥ khaḍgajināś ca sādhyam
icchanti rūpādyupadher virāmam || 4 ||","prakṣiptam api vyākhyāyate—ambha iti || ambhobindūnāṃ varṣodabindūnāṃ grahaṇe | ""sarvaṃ sahāpatitam ambu na cātakasya hitam"" iti śāstrād bhūspṛṣṭodakasya teṣāṃ rogahetutvād antarāla eva svīkāre caturāṃś cātakān vīkṣyamāṇāḥ kautukāt paśyantaḥ śreṇībhūtā baddhapaṅktiḥ || abhūtatadbhāve cviḥ || balākā bakapaṅktīḥ parigaṇanayaikā dve tisra iti saṅkhyānena nirdiśanto hastena darśayantaḥ siddhāḥ stanitasamaye tvaṅgarjitakāle sotkampāny utkampapūrvakāṇi priyasahacarīṇāṃ saṃbhrameṇāliṅgitāny āsādya | svayaṃ grahaṇāśleṣasukham anubhūyety arthaḥ || tvāṃ mānāyaṣyanti | tvannimittatvāt sukhalābhasyeti bhāvaḥ ||",0
cmt_1.2,"atha bhagavān vajrasattvaḥ kṛṣṇācalasamādhiṃ samāpadyedam udājahāra |
bhāvābhāvavinirmuktaś caturānandaikatatparaḥ |
niṣprapañcasvarūpo ‘haṃ sarvasaṃkalpavarjitaḥ ||1.2||","evaṃ mayetyādyāha saṅgītikāraḥ | nidānavākyaṃ etat | yasmāt saṅgītikāreṇa sūtratantrādāv avaśyaṃ vaktavyaṃ | bhagavato vacanāt | tathā ca | evaṃ mayā śrutam iti kṛtvā bhikṣavo mama dharmaḥ saṅgātavyam ityādi | evaṃ sati | 

śraddhāvatāṃ pravṛttyaṅgaṃ śāstā parṣac ca sākṣiṇi | 
deśakālau ca nirdiṣṭau svaprāmāṇyaprasiddhaye || iti pratipāditaṃ bhavati ||

tatra | evam iti yathā saṃgāsyāmi | mayety anena viparītaśrutaparaṃparāśrutayor nirāsaḥ | etenātmanaḥ sākṣāt śrutam aviparītaṃ ca pratipādayati | śrutam iti śrotajñānenādhigatam | ekasmin samaya iti | ekasmin kāle | anyasmin kāle tv anyad api śrutam ity arthaḥ | etenātmano bāhuśrutyam etattantrasya daurlabhyaṃ ca pratipādayati | bhagavān iti | bhagā aiśvaryādayaḥ | tathā ca | aiśvaryasya samagrasya jñānasya yaḥ yaśasaḥ śriyaḥ rūpasyātha prayatnasya ṣaṇṇāṃ bhagasya iti śrutiḥ || tāni vidyante 'syeti rāgādikleśabhañjanād vā | 
vajrasattva iti | vajram abhedyaṃ sattvam arthakriyākāritvam asyeti | athavā vajra iva vajraḥ sa cāsau sattvaḥ prāṇī ceti | sarvetyādi | sarve ca te tathāgatāś ca teṣāṃ kāyavākcittaṃ jīvaccharīra tasya hṛdayam atyantābhilaṣaṇīyatvāt | tad eva vajradhātvīśvarībhagam ||

vajro liṅgaṃ tasya dhātuḥ sāṃvṛtavivṛtatvalakṣaṇaḥ | bodhicittaṃ tasyeśvarī vā prajñā vajradhātunā sevitatvāt tasyāḥ | tadvarāṅge bhage vijahāreti | vihṛtavān vajrapadmasaṃyogena sampuṭayogena sthitavān ity arthaḥ | ayaṃ ca vihāraḥ prākṛtajanasyāpy atyantagupto bhavati kiṃ punar bhagavato vajrasattvasya | tataś cārthād uktaṃ bhavati | sumerugirimūrdhnivajrasatvabhūmau vajramaṇiśikharakūṭāgāre viharati smeti | etena śāstrā kālo deśaś coktaḥ ||

parṣadaṃ vaktum āha | anekaiścetyādi | vajrayoginaḥ | śvetācalādayaḥ | vajrayoginyo mohavajryādayaḥ | teṣām tāsāṃ ca gaṇāḥ samūhā ekarasāktāḥ bahuvacanaṃ tv ekavacanasyāpi pañcatathāgatātmatvāt ||

tadyathetyupadarśane | śvetācaleneti bhagavato bhagavatīdehagatarūpajñānena | evaṃ pītācaleneti | bhagavatīdehagatagandhajñānena | raktācaleneti | bhagavatīdehagatarasajñānena | śyāmācaleneti | bhagavatīdehagatasparśajñānenana || 

mohavajryā ceti | bhagavatyo bhagavaddehagatarūpajñānena | piśunavajryā ceti bhagaddehagatagandhajñānena | rāgavajryā ceti bhagavaddehagatarasajñānena | īrṣyāvajryā ceti bhagavaddehagatasparśajñānena | svayaṃ tu bhagavān bhagavatīdehagataśabdajñāne rūpaḥ | bhagavatī tu bhagavaddehegataśabdajñānarūpā ato naitat prabhedaḥ kṛtaḥ ||

evaṃ pramukhair iti | evaṃprakāraiḥ | cakṣuṣā ghrāṇena rasanayā kāyena śrotreṇa rūpeṇa vedanayā saṃjñayā saṃskāreṇa vijñānena pṛthivyā jalena tejasā vāyūnā ākāśena ityādibhir ityarthaḥ | etenaivamvidhe vihāre parṣaddevyopyetāddṛśyo bodhicitte tu kathitaṃ bhavati ||",0
seni_17,"tyaja dharmam adharmaṃ ca ubhe satyānṛte tyaja |
ubhe styānṛte tyaktvā yena tyajasi tat tyaja || SeNi 17 ||","īrṣyāmalaprakṣālanām āha.

parakīyaguṇavardhanavacaneṣu tatparitoṣaṇāya sādhu sādhu bhadrakam idam iti śabdam adhyāśayenoccārayet. kuśalakarmakāriṇam api dṛṣṭvā sādhu kṛtam dhanyo bhavān sukṛtakarmakārītyādibhiḥ stutivacanaiḥ protsāhayet.",0
bca_5.70,"kāye naubuddhim ādhāya gatyāgamananiścayāt |
yathākāmaṅgamaṃ kāyaṃ kuru sattvārthasiddhaye || 5.70 ||","saṃprajanyasya utpattisthairyayoḥ smṛtireva kāraṇamiti kathayann āha.

yadā smṛtir manogṛhadvāri kleśataskarasaṃghātānupraveśanivāriṇī dauvārikavadavasthitā bhavati, tadā saṃprajanyam ayatnata evotpadyate. utpannaṃ ca sat sthirībhavati.",0
bca_5.90,"nodāradharmapātraṃ ca hīne dharme niyojayet |
na cācāraṃ parityajya sūtramantraiḥ pralobhayet || 5.90 ||","tad eva dauṣprajñavikṣepāsamyakpraṇidhivipakṣābhibhūtirahitatvenāha mahādhyānetyādi |

tatrāsyāṃ gāthāyāṃ dhyānaprajñayor vyatyayo draṣṭavyaḥ | tataś cāyam arthaḥ | mahāprajñāśarīradhṛg iti vajradhūpā | mahati prajñā mahāprajñā saiva śarīraṃ tad dhārayatīti mahāprajñāśarīradhṛk || mahādhyānasamādhistha iti vajrapuṣpā | samādhiś cittasyaikāgratālakṣaṇas tasmiṃs tiṣṭhatīti samādhisthaḥ | mahac ca tad dhyānaṃ ca mahādhyānaṃ mahattvaṃ caturdhyānātmakatvāt | teṣu caturṣu dhyāneṣu samādhisthaḥ || praṇidhir iti vajradīpā | praṇidhīyata iti praṇidhiḥ | bodhisattvānāṃ praṇidhānavaśād utpatteḥ || mahopāya iti vajragandhā | mahāṃś cāsāv upāyaś ca mahopāyaḥ | tata evopāyabalenāśeṣānavaśeṣasya sattvadhātor yathāśayābhiprāyaparipūraṇāt || 

ata eva prajñādhyānapraṇidhyupāyapāramitālakṣaṇatayā bāhyapūjācatuṣṭayātmakam iti ||

sāmbhogikamārgaprītihetubhāvena balajñānayor dharmadhātvavatārasvabhāvatvāt tayor eva balajñānayoḥ pravibhāgaḥ | tatra balaṃ śraddhādipañca | jñānaṃ darśanamārge bhāvanāmārge ca | tatra darśanamārge bodhyaṅgeṣu | bhāvanāmārga āryāṣtāṅgeṣu || 

tataś ca śraddhāvīryasmṛtisamādhirūpatayā dvārapālacatuṣṭayātmakaṃ mahāyānābhisampratyayapravṛttitannairantaryasantuṣṭikāraṇatvāt ||",0
bca_5.50,"yadātmotkarṣaṇābhāsaṃ parapaṃsanam eva ca |
sādhikṣepaṃ sasaṃrambhaṃ sthātavyaṃ kāṣṭhavat tadā || 5.50 ||","ātmotkarṣaṇaṃ svaguṇātiśayaprakāśanam. tadābhāsaṃ tatpratibhāsaṃ tadvikalpanāt. parapaṃsanaṃ paravigrahaḥ doṣāviṣkaraṇaṃ vā, tadyuktam. adhikṣepaḥ parasya vacanatiraskāraḥ. saṃrambhaḥ sadākalivivādanimittacittapradoṣaḥ. ubhayatra saha tena vartata iti vigrahaḥ. evaṃ yadā paśyet svakaṃ manaḥ, sthātavyaṃ kāṣṭhavat tadeti sāmānyoktam abhisaṃbadhyate.",1
cmt_2.6,"vajrāvalīṃ tu tenaiva aṣṭastambhāṃś ca kalpayet |
dvārāt triguṇitaṃ kuryāt dvāratoraṇam uttamam || 2.6 ||",hariṇadvayaveṣṭitāṃ kuryāt | tadadhaḥ kramaśīrṣapaṭṭikāṃ dadyāt | toraṇapārśvadvaye tu yathāśobhaṃ vajrāradvayaṃ dadyāt | cihnadvayaṃ koṇacchatraṃ ca | evaṃ yathāśobhaṃ darpaṇacāmarādikaṃ likhet | maṇḍalasya catuḥkoṇebhyo niḥśaṅka nānārūpān kalpavṛkṣān saṃlikhet ||,1
bca_5.84,"evaṃ buddhvā parārtheṣu bhavet satatam utthitaḥ |
niṣiddham apy anujñātaṃ kṛpālor arthadarśinaḥ || 5.84 ||","tasmāt sarvakalmaṣaparityāgena iyam ucitā karmakāritā śikṣaṇīyety āha.

sarvāvadyavinirmuktatvād viśvastam. ānupūrvyā vyavasthitapadam. asaṃdigdhārtham. manaḥprahlādanakaram. śravaṇāpy āyakam. karuṇārasaniṣyandabhūtaṃ na rāgādinidānam. mṛdusvaramakarkaśavacanam. mandasvaraṃ yāvatā dhvaninā pratipādyasya pratītiḥ syāt, na tato nyūnaṃ nātiriktam udīrayan.",0
bca_5.85,"vinipātagatānāthavratasthān saṃvibhajya ca |
bhuñjīta madhyamāṃ mātrāṃ tricīvarabahis tyajet || 5.85 ||",he amalakamaladalalocana | amalaṃ śuddhaṃ yat kamalaṃ tasya dalaṃ tadvallocane yasya tasya saṃbodhane | punaḥ kiṃbhūta | bhavamocana | bhavāt saṃsārānmocayatīti muktiṃ prāpayatīti tasya saṃbodhanam | punaḥ kiṃbhūta | tribhuvanabhavananidhāna | trayāṇāṃ bhuvanānāṃ samāhārastribhuvanaṃ tasya bhavanam utpattiḥ tasya yā avidyā tayā parikalpitaṃ tasya nidhānam ādhāraḥ tasya saṃbodhanam | athavā tribhuvanameva bhavanamiva bhavanam āśrayaḥ |,0
cmt_3.2,"atha bhagavān āha | 
ādau triśaraṇaṃ dadyāt pañcaśikṣāś ca poṣadham |
tataḥ pañcābhiṣekaṃ tu guhyaṃ prajñāṃ ca śeṣataḥ || 3.2 ||",ādāv ityādikam uddeśaḥ ||,1
bca_5.15,"sahāpi vākcharīrābhyāṃ mandavṛtter na tat phalam |
yat paṭor ekakasyāpi cittasya brahmatādikam || 5.15 ||",he keśava | dhṛtavāmanarūpa | dhṛtaṃ vāmanaṃ rūpaṃ yena sa tathā tasya saṃbodhanam | he adbhutavāmana | tvaṃ baliṃ chalayasi pravañcayasi | kasmin viṣaye | vikramaṇe | viḥ pakṣī viruddhaḥ tasyākramaṇaṃ tasmin iti dhvaniḥ | vikramaṇaviṣaye he padanakhanīrajanitajanapāvana | padasya nakhāḥ padanakhāḥ teṣāṃ nīraṃ jalaṃ tena janitaṃ utpāditaṃ janāya pāvanaṃ pavitrībhāvo yenaṃ sa tathā tasya saṃbodhanam |,0
seni_33,"jñānajñeyāsamārope manyanā tatra nānyathā |
sarvaṃ tathā yathā pūrvaṃ yathā buddhis tathā na hi || SeNi 33 ||","kutaḥ punar evam ity uktam evārthaṃ spaṣṭayann āha.

taskarāś caurāḥ, teṣāṃ saṃghāto avatāragaveṣakaḥ piśācavad avatāramārgaprekṣī, chidrānveṣaṇatatpara ityarthaḥ. prāpyāvatāraṃ praveśamārgam āsādya muṣṇāti. tato hanti śobhanagataye jīvitapratilambhaṃ kuśalapātheyābhāvāt.",0
