pair_id,root,commentary,label
ht_1.5.3,"sevitavyāḥ prayatnena yathā bhedo na jāyate |  
agupte kriyate duḥkhaṃ vyāḍacaurāgnibhūcaraiḥ || 3 ||","prayatneneti guptau yatnaḥ prayatnaḥ. tam eva āha—yathā bhedo na jāyata iti. bheda udbhedaḥ svayam eva pareṣāṃ yuktibalād abhyūhaḥ. mantrabhedaś ca bhedaḥ. madauddhatyakopādibhiḥ svayaṃ tayā sahāyena vā parasmai kathanaṃ mantrabhedaḥ. 

aguptau narakapātādir adṛṣṭadoṣaḥ prasiddha eva. dṛṣṭadoṣam apy āha—agupta ityādinā. vyāḍādibhiḥ duḥkhaṃ kriyata iti sambandhaḥ. vyāḍāḥ sarpavyāghrādayaḥ. bhūcarāḥ śāsakā narapiśācādayaḥ.",1
seni_32,"yāvān sarvasamāropaḥ sa sarvaḥ sarvathā na hi |
madhyamārtho nirāropas tatrāpohavidhī kutaḥ || SeNi 32 ||","tad eva sopaskāram āha—yāvān ityādi | yatas tatra madhyamārthe yāvān samāropo 'dhyavasāyaḥ sa sarvo nāsti | evaṃvidhaḥ samāropābhāvo vijñānanaye apīṣṭaḥ | ata āha—sarvatheti | tatra hi vijñānasya vastusattvasamāropāspadatvam asti | ato na tatra sarvathā samāropābhāvaḥ |

etena māyopamasiddhānto 'pi pratyuktaḥ | kutaḥ | āstāṃ tāvad atra sarvavikalpo 'dhyavasāyānām apohaviṣayatayā nirāropatvaṃ ca vijñānavāde 'pi nirāropasambhavāt | tato madhyamārtho nirāropo niṣprapañcaḥ | param ayaṃ viśeṣaḥ | vijñānavāde nirvikalpatve 'pi gāḍhataravijñānasadbhāvāvidyāvaśād āhatyollekhābhāve 'pi cetasi tadaiva svasaṃvidgrahāt pṛṣṭhe vedanagrahaḥ sphuṭa eva | 

nanu tavāpy etat samam | pṛṣṭhe sarvavikalpabhāvāt | na | apratiṣṭhānatvenānāstheyasattvānurodhāt saṃvṛtyā vyavahārāt | atas tatrāpohavidhī vidhiniṣedhau kutaḥ | naivety arthaḥ |",1
seni_22,"vajragarbhe tadagre vā patitaṃ vā kapālake |
na ceṣṭam antarāle 'pi tattvaṃ vittau guror mukhāt || SeNi 22 ||",nanu ṣaṇṇāṃ kalaśābhiṣekatāpy uktā sarvatra kalaśavyāpārāt | sā tarhi katham | kalaśaśabdasya payodharopalakṣaṇatvena payodharavyāpārād atrāpi sā ghaṭate | tad etat sarvaṃ darśayati—hastetyādi | gatārtham ||,0
cmt_1.7,"śṛṇu vakṣye mahātantraṃ tantrarājeśvaraṃ param |
nāmnā caikallavīraṃ tu sattvānām āśusiddhaye ||1.7||",kāpi prauḍhagopī adhikaṃ yathā syāttathā dhyāyati | kim | madhusūdanavadanasarojam | madhudaityaṃ sūditavān marditavāniti madhusūdanaḥ tasya vadanameva sarojaṃ mukhakamalam | kiṃviśiṣṭam | vilāsavilolavilocanakhelanajanitamanojam | vilāsena līlayā vilole ca te vilocane nayane ca tābhyāṃ kṛtvā khelanaṃ tathā saha krīḍā tasmājjanito manojaḥ kandarpo yena sa tathā tat |,0
nasa_6,"praṇamya nāthaṃ saṃbuddhaṃ bhagavantaṃ tathāgatam |
kṛtāñjalipuṭo bhūtvā idam āha sthito 'grataḥ || 6 ||","kiṃ kṛtvā | praṇamya | kaṃ | nātham iti | anāthānāṃ lokānām anuśāsanāt nāthaḥ svāmī | taṃ || punar api kiṃviśiṣṭam nātham ity āha saṃbuddham iti samyaksaṃbuddhaṃ na śrāvakaṃ pratyekabuddhaṃ vā || bhūyo 'pi nāthaṃ viśinaṣṭi bhagavantam iti bhagasaṃpannatvād bhagavān | caturmārabhaṅgād vā | tathā cāha |

	kleśakarma tathā janma kleśajñeyāvṛtī tathā |
	yena vaipakṣikā bhagnās teneha bhagavān smṛtaḥ || iti ||

anena nairuktena vidhinā kleśādikaṃ bhagnavān iti bhagavān | aiśvaryādiguṇayogād vā | tathā cāha |

	aiśvaryasya samgrasya rūpasya yaśasaḥ śriyaḥ |
	jñānasyātha prayatnasya ṣaṇṇām bhaga iti smṛtiḥ || iti ||

punar api kiṃbhūtaṃ nātham ity āha tathāgataṃ iti | tathatāṃ śūnyatāṃ gataḥ tathāgataḥ | atha vā yathā te tathāgatā gatā gacchanti gamiṣyanti tathā gacchatīti tathāgataḥ | taṃ tathāgataṃ praṇamyeti pūrveṇa saṃbandhaḥ |",1
msv_1.10,"prāyeṇaiva hi mīmāṃsā loke lokāyatīkṛtā | 
tāmāstikapathe kartum ayaṃ yatnaḥ kṛto mayā || 1.10 ||",nanu mīmāṃsāyām api cirantananibandhanāni santīti kiṃ mudhā prayasyate | ata āha prāyeṇeti | lokāyataṃ nāma nāstikānāṃ tantram | tadbhāvamāpāditā nānāpasiddhāntasaṅgraheṇa | tāmāstikapathe kartum ayaṃ yatnaḥ kṛta iti | āśaṃsāyāṃ vartamāne 'rthe vā kto varṇanīya iti ||,1
bca_5.95,"na bāhūtkṣepakaṃ kaṃcic chabdayed alpasambhrame |
acchaṭādi tu kartavyam anyathā syād asaṃvṛtaḥ || 5.95 ||","lokāprasādanivāraṇāyāha.

na bhujam utkṣipya kaṃcid āhvayet, alpaprayojanatāratamye. mahati punar adoṣaḥ. acchaṭādiśabdaṃ tu kuryāt. tadakaraṇe 'samāhitacāritāyām asaṃvṛtaḥ syāt. etāvatā auddhatyaparihāro 'pi darśito bhavati.",1
seni_7,"tathā ca devīparipṛcchāśivanirnādatantra— 
ratnapuram idaṃ devi kiñjalke jalatāṃ vrajet |
rudro yugme śivaḥ śreṣṭhaḥ śaktiḥ saiva parātparā || Seni 7 ||",nanu śaivādīnāṃ kim etad asti | ata āha—ratnapuram ityādi | ratnaṃ maṇiḥ | tad eva puraṃ sthānaṃ yasya sukharūpābhimatasya tad ratnapuram | kiñjalke patitam | jalatāṃ niḥsāratām | rudro bhagavān | yugme samāpattau | śivaḥ kalyāṇāvāhakaḥ | ata eva śreṣṭhaḥ | saiva tattvaṃ śaktiś cidrūpā | parāc chreṣṭhāt parā śreṣṭhā tad eva ||,1
nasa_2,"vibuddhapuṇḍarīkākṣaḥ protphullakamalānanaḥ |
prollālayan vajravaraṃ svakareṇa muhur muhuḥ || 2 ||","tad eva sopaskāram āha—yāvān ityādi | yatas tatra madhyamārthe yāvān samāropo 'dhyavasāyaḥ sa sarvo nāsti | evaṃvidhaḥ samāropābhāvo vijñānanaye apīṣṭaḥ | ata āha—sarvatheti | tatra hi vijñānasya vastusattvasamāropāspadatvam asti | ato na tatra sarvathā samāropābhāvaḥ |

etena māyopamasiddhānto 'pi pratyuktaḥ | kutaḥ | āstāṃ tāvad atra sarvavikalpo 'dhyavasāyānām apohaviṣayatayā nirāropatvaṃ ca vijñānavāde 'pi nirāropasambhavāt | tato madhyamārtho nirāropo niṣprapañcaḥ | param ayaṃ viśeṣaḥ | vijñānavāde nirvikalpatve 'pi gāḍhataravijñānasadbhāvāvidyāvaśād āhatyollekhābhāve 'pi cetasi tadaiva svasaṃvidgrahāt pṛṣṭhe vedanagrahaḥ sphuṭa eva | 

nanu tavāpy etat samam | pṛṣṭhe sarvavikalpabhāvāt | na | apratiṣṭhānatvenānāstheyasattvānurodhāt saṃvṛtyā vyavahārāt | atas tatrāpohavidhī vidhiniṣedhau kutaḥ | naivety arthaḥ |",0
ht_1.5.9,"kulāni ṣaḍvidhāny āhuḥ saṃkṣepeṇa tu pañcadhā |  
paścāt trividhaṃ yānti kāyavākcittabhedanaiḥ || 9 ||",nanu sarvabuddhāḥ pañcajñāninaḥ. tat kathaṃ kulabhedaḥ? gotrabhedāt. ādarśādīnām ekaikasya hi cchāyo gotram anādisiddhaṃ bodhisattvānām. anekasya tu cchāyā sattvagotraṃ ṣaṣṭham. ata evāha—kulāni ṣaḍvidhāny āhur iti. saṃkṣepeṇa tu pañcadhety anekacchāyasyāpy ekacchāyā balīyastvāt. trividham iti traividhyam. kāyavākcittabhedanair iti vacanāt svakāyavākcitteṣu sarvatathāgatakāyavākcittādhimokṣas tattvayoga iti gamyata eva.,1
seni_13,"śaktisaṅgamasaṅkṣobhāc chaktyāveśāvasānikam |
yat sukhaṃ brahmatattvasya tat sukhaṃ svākyam ucyate || Seni 13 ||","bhagavatsiddhāntavedānte 'pi dṛṣṭāntopalakṣitaṃ prāg uktam āha—śaktītyādi | śaktir iti lalanā | tatsaṅgamaḥ samparkaḥ | tatsaṅkṣobhaḥ sañcālanaṃ tataḥ | śaktyāveśāvasānikam iti śaktyām aṅganāyām āveṣo 'bhiniveśa uttarottaro 'nutarāgas tadavasānikaṃ tatparyantajaṃ sukhaṃ yad brahmatattvasya jñānatattvasya tat sukhaṃ svākyaṃ svakīyam ucyate | anena bolagarbhatadagrāntarālakapālasthaiḥ sāmyam ācaṣṭe |

	sakalalalanāsamudgatasuratānandakṣaye kāle |
	nodeti saṃvid anyā tāvat kaulāgamābhyudayaḥ ||

iti vacanāt ||",1
bca_5.25,"asaṃprajanyacittasya śrutacintitabhāvitam |
sacchidrakumbhajalavan na smṛtāv avatiṣṭhate || 5.25 ||","anayoḥ samudāyābhāve doṣam uktvā pratyekam abhāve kathayitum āha.

na vidyate saṃprajanyaṃ yasmiṃs tad asaṃprajanyam. taccittaṃ yasya tasya. śrutacintābhāvanāmayaprajñāpariniṣṭhitaṃ vastu na smaraṇam adhivasati. tanmūlaṃ ca sarvaṃ kalyāṇam. kim iva? yathā sacchidrakumbhe mukhanikśiptam udakam adhastād gacchati nāvatiṣṭhate.",1
bca_5.2,"adāntā mattamātaṅgā na kurvantīha tāṃ vyathām |
karoti yām avīcyādau muktaś cittamataṅgajaḥ || 5.2 ||","ito 'pi cittam eva rakṣaṇīyam ity āha.

aparikarmitā mattavaravāraṇā na janayanti tāṃ pīḍām iha loke. paraloke avīcyādau yāṃ karoti svacchandatayāvasthitaṃ cittam eva mataṅgaja eva. tathāgatājñāṅkuśena kathaṃcid vaśīkriyamāṇatvāt.",1
cmt_2.25,ity ekallavīrākhye śrīcaṇḍamahāroṣaṇatantre maṇḍalapaṭalo dvitīyaḥ || 2.25 ||,maṇḍalapradhānatvāt maṇḍalapaṭalaḥ || iti dvitāyapaṭalavyākhyā ||,1
nasa_36,"mahādānapatiḥ śreṣṭho mahāśīladharo 'graṇīḥ |
mahākṣāntidharo dhīro mahāvīryaparākramaḥ || 36 ||","evaṃ mātsaryadauḥśīlyākṣāntikausīdyapratipakṣatayā tad eva dānaśīlakṣāntivīryapāramitātmakam iti | ata āha mahādānetyādi ||

tatra mahādānapatiḥ śreṣṭha iti vajralāsyā | pūjānugrahakāmyayā dīyata iti dānaṃ | tasya dānasya patir dānapatiḥ | mahāṃś cāsau dānapatiś ca mahādānapatiḥ | āmiṣābhayadharmābhiṣekātmakacaturdānotsṛjanatayā śreṣṭhaḥ sarvalokotkṛṣṭatvāt || mahāśīladharo 'graṇīr iti vajramālā | kāyavākcittānāṃ samādhānāc chīlaṃ | śīla samādhāv iti dhātvarthatvāt | daśākuśalaviratilakṣaṇaṃ prātimokṣasvabhāvaṃ ca | tad dhārayatīti śīladharaḥ | mahāṃś cāsau śīladharaś ca mahāśīladharaḥ | ata evāgraṇīḥ purahsara ity arthah || mahākṣāntidharo dhīra iti vajragītā | kṣamaṇaṃ kṣāntis titikṣā tāṃ dhārayatīti kṣāntidharaḥ | mahaṃś cāsau kṣāntidharaś ca mahākṣāntidharaḥ | tataś ca dhīraḥ | mahatsv api duḥkheṣu dhairyāvalambanatvāt || mahāvīryaparākrama iti vajranṛtyā | vīryaṃ kuśala utsāhaḥ | pāpādau tūtsāhaḥ kusīdatvāt kausīdyam eva na vīryaṃ | tasya parākramaḥ sarvalaukikalokottarakuśalamūlaparipūraṇāt | 

ataś ca guhyapūjācatuṣṭayātmakaṃ yathākramam ādarśādijñānaniṣpattau svavimokṣamukhaviśuddhibalenānābhogābhirativiśeṣotpādakatvāt ||",1
cmt_1.13,"yamadūtais tato grastaḥ kālapāśavaśīkṛtaḥ |
narakaṃ nīyate pāpī yadi buddhair api rakṣitaḥ ||1.13||",yamadūto yamapuruṣaḥ | grasto gṛhītaḥ | kālo mṛtyuḥ | sa hi pāśa iva pāśaḥ | narakamavīcyādikaṃ | buddhairiti buddhapraṇītamahāpratisarādirakṣāvidhibhiḥ ||,1
msv_1.1,"viśuddhajñānadehāya trivedīdivyacakṣuṣe |
śreyaḥprāptinimittāya namaḥ somārdhadhāriṇe || 1.1 ||",vārttikārambhe śiṣṭācāramanuvidadhāno maṅgalaṃ tāvat karoti viśuddheti | dṛṣṭā hi śiṣṭānāṃ pravṛttiḥ sarvakāryeṣu maṅgalācaraṇapūrvikā | maṅgalaṃ ca devatāstutinamaskārādi | asya ca niyogataḥ phalavatkāryāntarārambhasaṃyogāt sākṣād aphalatvāc ca phalavatsannidhāvaphalaṃ tadaṅgam iti nyāyena kāryāntaraśeṣatve 'vadhṛte satyārambhasya samāptiparyantatvād apekṣitāvighnaparisamāptiḥ phalam | apekṣitavidher anapekṣitavidhānaṃ durbalam iti nyāyena phalāntarakalpanāyā durbalatvāt | ato yathā sāmpradāyikam adhyāyānadhyāyādi svādhyāyāvighnārtham evam idam api | tad ayam arthaḥ viśuddhau jñānadehau yasya sa tathoktaḥ | viśuddhaṃ ca bhagavato jñānaṃ rāgādibhir jñānakāraṇānām adūṣitatvād dehaś cāyonijatvād vividhagarbhavedanāvirahāc ca | trivedī ca tasya cakṣur iti gauṇo vādaḥ asandigdhāviparītaspaṣṭavedārthaprakāśakatvāt | divyaṃ cātīndriyārthagocaratvāt | bhautikaṃ hi cakṣuḥ pratyutpannārthaviṣayam | idaṃ tv anāgatādiviṣayaṃ divyam iti | śreyasaś ca hitāhitaprāptiparihārātmano bhagavān nimittam | somārdhadhāriṇe somakalādhāriṇe | nama iti | yady api vigrahādipañcakaṃ devatādhikaraṇe nirākariṣyate tathāpyājyādistotravat pradhānakarmaṇa eva devatāstuter evaṅkṛtāyāḥ phalam ity adoṣa iti ||,1
cmt_1.18,"bhidyate mūrdhni vajreṇa vṛṣṭikāle na saṃśayaḥ |
tathyam etan mayā devi bhāṣitaṃ ca varānane || 1.18 ||",vṛṣṭikāla iti | prāyeṇa varṣaṇakāla eva tasya sadbhāvāt | varānane śobhanamukhi ||,1
gg_1.3,"vācaḥ pallavayatyumāpatidharaḥ saṃdarbhaśuddhiṃ girāṃ jānīte jayadeva eva śaraṇaḥ ślāghyo durūhadrute |
śṛṅgārottarasatprameyaracanairācāryagovardhanaspardhī ko 'pi na viśrutaḥ śrutidharo dhoyī kavikṣmāpatiḥ ||",umāpatidharo vācaḥ pallavayati kevalaṃ komalāṃ vācaṃ vistārayatītyarthaḥ | na tu girāṃ vāṇīnāṃ saṃdarbhaśuddhiṃ jānīte | tathā śaraṇaḥ kaviḥ ślāghyaḥ praśastaḥ | kasmin viṣaye | durūhadrute | duḥkhena apyūhituṃ śakyata iti durūhaḥ | durūhaṃ ca drutaṃ ca taṃ tasmin | atiśīghraṃ vaktuṃ samartha ityarthaḥ | tathā ācāryo govardhanaḥ ślāghyaḥ | kaiḥ śṛṅgārottarasatprameyaracanaiḥ | śṛṅgārottarāṇi śṛṅgārapradhānāni ca satprameyāni utkṛṣṭaprameyāni ca teṣāṃ racanāni | śṛṅgārottarasatprameyaracanāni taiḥ | tathā dhoyī nāma kavikṣmāpatiḥ kavirājaḥ śrutidharaḥ śrutyā śravaṇena dhārayatītyarthaḥ | asya ślokasya kaviḥ kṣmāpatiḥ rājā lakṣmaṇasenaḥ |,1
bca_5.54,"evaṃ saṃkliṣṭam ālokya niṣphalārambhi vā manaḥ |
nigṛhṇīyād dṛḍhaṃ śūraḥ pratipakṣeṇa tat sadā || 5.54 ||",tvamevātmeśa iti | sarvastāvadātmane spṛhayāluḥ | vastutastu tvameva cidrūpo 'syātmā iti | atastvayyātmani svataḥsiddhā bhaktiḥ kevalaṃ samāveśayuktyā yadi tāṃ jānāti tajjayet sarvotkarṣeṇa vartata eva | niyoge liṅ ||,0
cmt_1.11,"evaṃ buddhvā tu yaḥ kaścid yogi lobhaviḍambitaḥ |
caṇḍasya maṇḍalādṛṣṭe deśayet tantram uttamam || 1.11 ||",hariṇadvayaveṣṭitāṃ kuryāt | tadadhaḥ kramaśīrṣapaṭṭikāṃ dadyāt | toraṇapārśvadvaye tu yathāśobhaṃ vajrāradvayaṃ dadyāt | cihnadvayaṃ koṇacchatraṃ ca | evaṃ yathāśobhaṃ darpaṇacāmarādikaṃ likhet | maṇḍalasya catuḥkoṇebhyo niḥśaṅka nānārūpān kalpavṛkṣān saṃlikhet ||,0
bca_5.34,"pūrvaṃ tāvad idaṃ cittaṃ sadopasthāpyam īdṛśam |
nirindriyeṇeva mayā sthātavyaṃ kāṣṭhavat sadā || 5.34 ||","kalyāṇamitrasya paryupāsanaparijñānārtham āha.

śrīsaṃbhavavimokṣād āryagaṇḍavyūhaparivartāt kalyāṇamitraparyupāsanaṃ śikṣet jānīyāt. yathoktam āryagaṇḍavyūhe āryaśrīsaṃbhavena- 

	kalyāṇamitrasaṃdhāritāḥ kulaputra bodhisattvā na patanti durgatiṣu. yāvat saṃcodakāḥ kalyāṇamitrā akaraṇīyānām. saṃnivārakāḥ pramādasthānāt. niṣkāsayitāraḥ saṃsārapurāt. tasmāt tarhi kulaputra evaṃmanasikārāpratiprasrabdhena kalyāṇamitrāṇy upasaṃkramitavyāni. pṛthivīsamacittena sarvabhārodvahanāparitasanatayā. vajrasamacittenābhedyāśayatayā. cakravālasamacittena sarvaduḥkhāsaṃpravedhanatayā. lokadāsasamacittena sarvakarmasamādānāvijugupsanatayā. rajoharaṇasamacittena mānābhimānavivarjanatayā. yānasamacittena gurubhāranirvāhanatayā. aśvasamacittena akrudhyanatayā. nausamacittena gamanāgamanāparitasanatayā. suputrasadṛśena kalyāṇamitramukhavīkṣaṇatayā. ātmani ca te kulaputra āturasaṃjñotpādayitavyā kalyāṇamitreṣu ca vaidyasaṃjñā, anuśāsanīṣu bhaiṣajyasaṃjñā, pratipattiṣu vyādhinirghātanasaṃjñā. ātmani ca te kulaputra bhīrusaṃjñotpādayitavyā, kalyāṇamitreṣu śūrasaṃjñā, anuśāsanīṣu praharaṇasaṃjñā, pratipattiṣu śatrunirghātanasaṃjñā.

yad uktaṃ sūtrāṇāṃ ca sadekṣaṇād iti tad upadarśayitum āha. etad iha śāstre pratipāditam, anyad yad iha noktam. buddhena bhagavatā bodhisattvānāṃ karaṇīyatayā nirdiṣṭam, tan nānāsūtrāntārthaparicayād veditavyam.",0
bca_5.45,"nānāvidhapralāpeṣu vartamāneṣv anekadhā |
kautūhaleṣu sarveṣu hanyād autsukyam āgatam || 5.45 ||","ittham api niṣphalaṃ varjayed ity āha.

anekaprakāre 'saṃbaddhābhidhāne 'paropādhike pravartamāne, āścaryavastuṣu ca samasteṣu svayam api tatkriyāyāṃ darśanaśravaṇāya vākcittasya tāratamyaṃ nivārayet.",1
gg_3.9,"kṣamyatāmaparaṃ kadāpi tavedṛśaṃ na karomi |
dehi sundari darśanaṃ mama manmathena dunomi ||",tathā sā rādhā alolam acañcalaṃ yathā bhavati tathā kapolaṃ na tyajati | kena | paṇitalena | kadā | sāyaṃkāle | kamiva | bālaśaśinamiva | bālaścāsau śaśī ceti | tamiva | samagraṃ mukhaṃ pūrṇacandrānukāri bhavati | karatalapihitatadekadeśatvād bālacandreṇopamīyate |,0
nasa_21,"mahārthāṃ nāmasaṃgītiṃ pavitrām aghanāśanīm |
mañjuśrijñānakāyasya mattaḥ śrotuṃ samudyataḥ || 21 ||",tvamevātmeśa iti | sarvastāvadātmane spṛhayāluḥ | vastutastu tvameva cidrūpo 'syātmā iti | atastvayyātmani svataḥsiddhā bhaktiḥ kevalaṃ samāveśayuktyā yadi tāṃ jānāti tajjayet sarvotkarṣeṇa vartata eva | niyoge liṅ ||,0
bca_5.64,"evam anviṣya yatnena na dṛṣṭaṃ sāram atra te |
adhunā vada kasmāt tvaṃ kāyam adyāpi rakṣasi || 5.64 ||","evaṃ kathitanayena. sādhūktam iti cet, adhunā vada kasmāt tvam adyāpi sarvaguṇavikalam api kāyaṃ rakṣasi? evaṃ vidvān api.",1
seni_9,"na santi tattvato bhāvāḥ śaktirūpeṇa bhāvitāḥ |
śaktis tu śūnyatādṛṣṭiḥ sarvāropavināśinī || SeNi 9 ||","evam ātmabhāvādīnām utsargaṃ rakṣāṃ ca pratipādya punar vistareṇa rakṣāśodhanavardhanāni pratipādayitum upakramate. utpāditabodhicittena hi bodhisattvena utsṛṣṭasyāpi cātmabhāvasya rakṣāśodhanavardhanāni kāryāṇi. yasmāt-

	paribhogāya sattvānām ātmabhāvādi dīyate |
	arakṣite kuto bhogaḥ kiṃ dattaṃ yan na bhujyate ||

	tasmāt sattvopabhogārtham ātmabhāvādi pālayet |
	kalyāṇamitrānutsargāt sūtrāṇāṃ ca sadekṣaṇāt || (Sikṣāsamuccaya 5-6)

tac ca ātmabhāvādiparipālanādi śikṣārakṣaṇād eva syāt. anyathā narakādivinipātagamanāt tan na syāt. ata idam abhidhīyate.

śikṣyate upādīyate gṛhītasaṃvaraṇeneti vihiteṣu karaṇīyatā, pratiṣiddheṣv akaraṇaṃ śikṣā, tāṃ rakṣituṃ paripālayituṃ kāmena icchatā bodhisattvena ātmacittaṃ rakṣitavyaṃ prayatnata iti kathayiṣyamāṇāt. atha śikṣārakṣaṇādhikāre kim iti cittaṃ rakṣyata ity āha—na śikṣeti. anyathā śikṣaiva rakṣitumaśakyā calam anāyattaṃ cittam arakṣatā. cittasya calatāyāṃ śikṣāyāḥ sthairyāyogāt.",0
bca_5.106,"saṅkṣepeṇāthavā tāvat paśyet sūtrasamuccayam |
āryanāgārjunābaddhaṃ dvitīyaṃ ca prayatnataḥ || 5.106 ||",vṛṣṭikāla iti | prāyeṇa varṣaṇakāla eva tasya sadbhāvāt | varānane śobhanamukhi ||,0
gg_1.25,"śrījayadevakaveridaṃ kurute mudam e
maṅgalamujjvalagītaṃ jaya jaya deva hare ||",maṇḍalapradhānatvāt maṇḍalapaṭalaḥ || iti dvitāyapaṭalavyākhyā ||,0
bca_5.101,"pāramparyeṇa sākṣād vā sattvārthaṃ nānyad ācaret |
sattvānām eva cārthāya sarvaṃ bodhāya nāmayet || 5.101 ||","iyam api śikṣāpadamudrāvadhārayitavyety āha.

antataḥ svayamāhārādikriyayā parapreraṇayāparāparadūtapreraṇayā vā, sākṣāt svayam evāmiṣadānādinā vā, yat sattvānāṃ hitasukhahetur na bhavati, tan na kuryāt kārayed vā. na caitad eva kevalam. kiṃcit sattvānām eva saṃsāraduḥkhapatitānāṃ tato niḥsaraṇāya sarvaṃ kuśalamūlam anuttarāyāṃ samyaksaṃbodhau pariṇāmayet.",1
msv_5.1.5 & 5.1.6,"nacaitāni parityajya pṛthag loke pramāṇatā |
saṃsāramocakādeśca hiṃsā puṇyatvasammatā || 5 ||
na paścāt puṇyamicchanti kecidevaṃ vigānataḥ |
mlecchāryāṇāṃ prasiddhatvaṃ na dharmasyopapadyate || 6 ||",nanu sannikṛṣṭārthagocaram eva sarvaṃ pramāṇam | ataḥ prasiddheḥ pramāṇāntarāgocarārthatvaṃ guṇaḥ na doṣāya ata āha na ceti | na ca pratyakṣādīni parityajya loko nāma pramāṇagaṇe pramāṇam upasaṃkhyāyate | varṇavivekasambandhāvadhāraṇayos tu pratyakṣādipramāṇatvaṃ vanasambandhaparihārayor abhidhāsyāma iti | api ca bhaved api prasiddhiḥ pramāṇaṃ yadi vyavasthitaiva prasiddhiḥ syāt | sā tv avyavasthitā | tathā hi saṃsāramocakā nāma nāstikā bāhyahiṃsām eva dharmam āhuḥ | anye tu tapaḥ prajāpatyādi pīḍātmakatvāt parapīḍāvat adharma ....... stu vidhiniṣedhapramāṇakau tadviparītau dharmādharmau saṅgirante | tad evaṃ mlecchāryāṇāṃ parasparavigānān na lokaprasiddhatvaṃ dharmādharmayor upapadyata ity āha saṃsāreti sārdhena ||,1
nasa_1,"atha vajradhara śrīmān durdāntadamakaḥ paraḥ |
trilokavijayī vīro guhyarāṭ kuliśeśvaraḥ || 1 ||","padārthas tv adhunā vyākhyāyate || atheti vajradharam adhikṛtyāha tasyādhyeṣakatvena prastutatvāt | āryamāyājālaṣoḍaśasāhasrikamahāyogatantrāntaḥpātisamādhijālapaṭalād bhagavacchākyamunibhāṣitā bhagavato mañjuśrījñānasattvasya paramārthā nāmasaṃgītir yā tasyā adhyeṣaṇārthaṃ bhagavān vajradharo mṛdvindriyasattvānugrahārthaṃ | punar apy athety āha | athaśabda ānantarye | atha vajradharo bhṛkuṭītaraṅgapramukhaiḥ sārdham nāthaṃ buddhaṃ bhagavantaṃ tathāgataṃ praṇamya kṛtāñjalipuṭo bhūtvā agrataḥ sthita idam āheti saṃbandhaḥ || vajraṃ dhārayatīti vajradharaḥ | anena padena gāmbhīryam abhidhīyate | śriyo devatyas tā vidyante yasyāsau śrīmān | anena caudāryaṃ sūcitaṃ | tataś ca kim uktaṃ bhavati | prajñopāyātmako bhagavān vajradhara iti | ata evoktaṃ śrīsaṃvare |

	sarvākāśāvakāśe śrīvajrasattvas tathāgataḥ |

iti | duḥkhena dāmyanta iti durdāntā īśvarādayas teṣāṃ damakaḥ śāsako vajradharavineyakatvāt teṣām īśvarādīnām | utkṛṣṭatvāṭ paro vajradharaḥ | bhūrlokabhuvarlokasvarlokā iti trayo lokāḥ | tān vijetuṃ śīlam asyeti trilokavijayī || atha vā jayakaramadhukarasarvārthasiddhikarās trayo bhrātaras trilokāḥ | tān vijetuṃ śīlam asyeti trilokavijayī | ata eva vīro bhagavān vajradharaḥ arair anabhibhavanīyatvāt || śrītattvasaṃgrahe pañca guhyāni paṭhyante | tathā hi |

	yathā yathā hi vinayaṃ yānti sattvāḥ svabhāvataḥ |
	tathā tathā hi sattvārthaṃ kuryād rāgādibhiḥ śuciḥ ||
	sarvasattvahitārthāya buddhaśāsanahetutaḥ |
	mārayan sarvasattvāṃs tu na sa pāpena lipyate ||
	sarvasattvahitārthāya buddhakāyaprayogataḥ |
	haraṃs tu paravittāni na sa pāpena lipyate ||
	rāgatulyaṃ sukhaṃ nāsti taj jinebhyaḥ samādadat |
	sattvārthāt paradārāṇi sevayan puṇyam āpnuyāt ||
	sarvasattvahitārthāya buddhaśāsanahetutaḥ |
	sarvakarmāṇi kurvaṃs tu bahu puṇyam avāpnuyāt ||

iti ||

teṣāṃ pañcānāṃ guhyānāṃ rājā guhyarāṭ | guhyair vā rājata iti guhyarāṭ || kuliśo vajras tasyeśvaraḥ kuliśeśvaraḥ || bhagavān vajradharo 'grataḥ sthito bhūtvā kṛtāñjalipuṭa idaṃ vakṣyamānam āheti kriyāpadaṃ sarvatra yojanīyam ||",1
gg_1.33,"mādhavikāparimalalalite navamālatijātisugandhau |
munimanasāmapi mohanakāriṇi taruṇākāraṇabandhau ||",kīrtir yaśaḥ. parivāraḥ dāsīdāsakarmakarādiḥ. upasthānaṃ pādadhāvanamardanādi. ebhir arthi tadabhilāṣaṃ mama cittam. tasmāt tiṣṭhāmi kāṣṭhavat.,0
bca_5.17,"duḥkhaṃ hantuṃ sukhaṃ prāptuṃ te bhramanti mudhāmbare |
yair etad dharmasarvasvaṃ cittaṃ guhyaṃ na bhāvitam || 5.17 ||","prajñā tu nirvivādā cittam evety āha.

pañcagatisaṃsārajātyādiduḥkhaṃ prahātuṃ tatprahāṇe nirvāṇasukham adhigantuṃ te sattvā mudhā nirarthakā eva bhramanty ambare kāsīpuṣpam iva niṣphalaṃ saṃsāre. yad anuṣṭhitaṃ kvacid api na lagnam iti tad eva mam idhīyate pañcāgnisevāśiroluñcanādivratam. ke punar evaṃ bhramanti? yaiḥ saṃsārabhayabhīrubhiḥ sukhārthibhiś ca dharmasarvasvaṃ sarvalaukikalokottarakarmanidānabhūtaṃ cittaṃ bālānām agocarasvabhāvatayā guhyaṃ na bhāvitaṃ tattvacittatayā punaḥ punaḥ sthirīkṛtam. tasmād iyam atitarāṃ cittam eva. yathopavarṇitam āryagaṇḍavyūhe-

	svacittādhiṣṭhānaṃ sarvabodhisattvacaryā. svacittādhiṣṭhānaṃ sarvasattvaparipākavinayaḥ. peyālam. tasya mama kulaputra evaṃ bhavati-svacittam evopastambhayitavyaṃ sarvakuśalamūlaiḥ. svacittam eva parisyandayitavyaṃ dharmameghaiḥ. svacittam eva pariśodhayitavyam āvaraṇīyadharmebhyaḥ. svacittam eva dṛḍhīkartavyaṃ vīryeṇa |

ityādi.",1
bca_5.95,"na bāhūtkṣepakaṃ kaṃcic chabdayed alpasambhrame |
acchaṭādi tu kartavyam anyathā syād asaṃvṛtaḥ || 5.95 ||","idam api bodhisattvenābhyasanīyam ity āha.

dakṣaḥ sarvatra paṭupracāraḥ. utthānasaṃpannaḥ kausīdyāpanayanād vīryasamanvāgataḥ. ata eva svayam eva sarvaṃ karaṇīyam, na parāpekṣā kvacid api karmaṇi kāryā. idam eva nāvakāśa ityādinā darśayati.",0
